id,sources_num,category,type,legitimacy,source_name,url,title,date,text,sources
1,3,politics,fact_check,Unproven, Snopes.com,https://www.snopes.com/fact-check/karl-rove-empire/,"Did Karl Rove Say 'We're an Empire Now'? 
Many have assumed it was Rove who made the comment during the George W. Bush administration.",2021-12-12,"Karl Rove, adviser to U.S. President George W. Bush, made an iconic comment that included the phrase, ""We're an empire now.""","['Andersen, Kurt. “How the U.S. Lost Its Mind.” The Atlantic, 8 Aug. 2017, https://www.theatlantic.com/magazine/archive/2017/09/how-america-lost-its-mind/534231/.', 'Suskind, Ron. “Faith, Certainty and the Presidency of George W. Bush.” The New York Times, 17 Oct. 2004. NYTimes.com, https://www.nytimes.com/2004/10/17/magazine/faith-certainty-and-the-presidency-of-george-w-bush.html.', 'Schonfeld, Zach. “We Made Karl Rove Listen to The National, and He Wasn’t Impressed.” Newsweek, 8 Sept. 2017, https://www.newsweek.com/national-sleep-well-beast-karl-rove-662307.']"
2,3,politics,fact_check,Correct Attribution, Snopes.com,https://www.snopes.com/fact-check/biden-bob-dole-end-of-message/,"Did Biden Read 'End of Message' During Bob Dole Tribute? 
Right-leaning critics of the president seized upon what appeared to be an unfortunate mistake during a speech in December 2021.",2021-12-10,"In a speech paying tribute to Bob Dole, in December 2021, President Joe Biden read aloud ""End of message.""","['“Opinion | Bob Dole: America Needs Unity to Rediscover Its Greatness.” Washington Post. www.washingtonpost.com, https://www.washingtonpost.com/opinions/2021/12/06/bob-dole-op-ed-what-america-needs/. Accessed 10 Dec. 2021.', '“Senate Leader, Presidential Candidate Bob Dole Dies at 98.” AP NEWS, 5 Dec. 2021, https://apnews.com/article/bob-dole-dead-kansas-republican-737084f4e606c10a33a15384fbe05967.', 'U.S. Senate: Robert J. Dole: A Featured Biography. https://www.senate.gov/senators/FeaturedBios/Featured_Bio_DoleRobertJ.htm. Accessed 10 Dec. 2021.']"
3,0,politics,fact_check,, Snopes.com,https://www.snopes.com/fact-check/kennedy-bloody-shirt/,"Are Photos of John F. Kennedy's Bloody Shirt Real? 
",2021-12-08,,[]
4,4,politics,fact_check,Correct Attribution, Snopes.com,https://www.snopes.com/fact-check/trump-innocent-fifth-amendment/,"Did Trump Say 'If You're Innocent, Why Are You Taking the 5th Amendment?' 
Trump has offered conflicting opinions of the Fifth Amendment over the years.",2021-12-08,"Former President Donald Trump said: ""If you're innocent, why are you taking the Fifth Amendment?""","['Sheth, Sonam. “Key Witness in Congress’ Capitol Riot Probe Says He Intends to Plead the 5th Amendment.” Business Insider, https://www.businessinsider.com/jeffrey-clark-january-6-committee-plead-5th-amendment-2021-12. Accessed 8 Dec. 2021.', '“‘If You’Re Innocent, Why Are You Taking the Fifth?’ Trump Said — Years after Invoking It Himself.” Washington Post. www.washingtonpost.com, https://www.washingtonpost.com/news/the-fix/wp/2017/05/23/if-youre-innocent-why-are-you-taking-the-fifth-trump-said-years-after-invoking-it-himself/. Accessed 8 Dec. 2021.', 'Trump and the Fifth Amendment: It’s Complicated. https://gulfnews.com/world/americas/trump-and-the-fifth-amendment-its-complicated-1.2031688. Accessed 8 Dec. 2021.', 'United States of America 1789 (Rev. 1992) Constitution – Constitute. https://www.constituteproject.org/constitution/United_States_of_America_1992?lang=en. Accessed 8 Dec. 2021.']"
5,2,politics,fact_check,False, Snopes.com,https://www.snopes.com/fact-check/lets-go-brandon-pedophile-code/,"No, 'Let's Go Brandon' Is Not a Code Used by Pedophiles Online 
A widely-shared meme appeared to be a distasteful prank at the expense of right-leaning critics of President Joe Biden.",2021-12-07,"In 2021, the phrase ""Let's go Brandon"" was a code used by pedophiles to identify each other online.","[' ', '“‘Let’s Go Brandon’: A Collection of Stories.” Snopes.Com, https://www.snopes.com/collections/lets-go-brandon/. Accessed 7 Dec. 2021.']"
6,12,politics,fact_check,False, Snopes.com,https://www.snopes.com/fact-check/patriot-front-rally-dc-fake/,"No, the 'Patriot Front' Far-Right Rally in DC Was Not Faked 
Right-wing politicians and commentators sought to play down a ""Patriot Front"" demonstration on the National Mall, in December 2021.",2021-12-06,"A Dec. 4, 2021, rally in Washington D.C. was staged or faked by federal agents or actors, rather than a real white nationalist group called Patriot Front.","['“19-Year-Old White Supremacist Cited for Hate-Speech Fliers Posted in Fort Worth.” Dallas News, 31 Oct. 2018, https://www.dallasnews.com/news/crime/2018/10/31/19-year-old-white-supremacist-cited-for-hate-speech-fliers-posted-in-fort-worth/.', '  “ANOTHER FALSE FLAG? A Group No One Has Ever Heard Of Marches In DC…Left Calls Them ‘Right-Wingers’…Conservatives Call Them A ‘False Flag.’” 100PercentFedUp.Com, 5 Dec. 2021, https://100percentfedup.com/another-false-flag-as-biden-and-harris-poll-numbers-plummet-a-group-no-one-has-ever-heard-of-marches-in-dc-left-calls-them-right-wingers-conservatives-call-them-a-false-flag/.', '  Attorney General James Takes Legal Action Against Conspiracy Theorists For Threatening Robocalls to Suppress Black Voters. https://ag.ny.gov/press-release/2021/attorney-general-james-takes-legal-action-against-conspiracy-theorists. Accessed 6 Dec. 2021.', '  Hoft, Jim. “FEDS ON PARADE: Dozens of Uhaul Trucks Picked Up Mysterious Patriot Protesters after Creepy March in DC — Another Democrat Stunt?” The Gateway Pundit, 5 Dec. 2021, https://www.thegatewaypundit.com/2021/12/feds-parade-dozens-uhaul-trucks-picked-mysterious-patriot-protesters-creepy-march-dc-another-democrat-stunt/.', '  “Nazis Go to School: How Texas Colleges Have Responded to the Hate Groups Behind All Those Racist Flyers.” The Texas Observer, 29 Jan. 2018, https://www.texasobserver.org/nazis-go-school-texas-colleges-responded-hate-groups-behind-racist-flyers/.', '  “Patriot Front.” Anti-Defamation League, https://www.adl.org/resources/backgrounders/patriot-front. Accessed 6 Dec. 2021.', '  “—.” Anti-Defamation League, https://www.adl.org/resources/backgrounders/patriot-front. Accessed 6 Dec. 2021.', '  Petrizzo, Blake Montgomery, Zachary. “White Supremacists Stage Bizarro Rally in Downtown D.C., Find Themselves Stranded.” The Daily Beast, 5 Dec. 2021. www.thedailybeast.com, https://www.thedailybeast.com/patriot-front-white-nationalists-stage-bizarro-rally-in-downtown-dc-find-themselves-stranded.', '  “Sen. Wendy Rogers Cues up the Crazy (Again) with Her Latest Call to Decertify the Election.” Arizona Republic, https://www.azcentral.com/story/opinion/op-ed/laurieroberts/2021/09/22/sen-wendy-rogers-cues-up-crazy-again-decertification-talk/5810505001/. Accessed 6 Dec. 2021.', '  “The Comically Flawed Attempt to Smear Robert Mueller, Explained.” Snopes.Com, https://www.snopes.com/news/2018/10/30/comically-flawed-attempt-smear-robert-mueller-explained/. Accessed 6 Dec. 2021.', '  Uniformed White Nationalist Group Marches at Lincoln Memorial – CNN Video. www.cnn.com, https://www.cnn.com/videos/us/2021/12/06/white-nationalists-march-lincoln-memorial-newday-jarrett-avlon-vpx.cnn. Accessed 6 Dec. 2021.', '  Zimmermann, Carol Schaeffer, Fritz. “They Are Racist; Some of Them Have Guns. Inside the White Supremacist Group Hiding in Plain Sight.” ProPublica, https://www.propublica.org/article/they-are-racist-some-of-them-have-guns-inside-the-white-supremacist-group-hiding-in-plain-sight?token=SstV5uby4K1aF_9o7uU0NxUx4Lmau-1g. Accessed 6 Dec. 2021.']"
7,0,politics,fact_check,False, Snopes.com,https://www.snopes.com/fact-check/trump-christmas-card-2021/,"Did Trump Send This Phallic Christmas Card in 2021? 
The card with a picture of former U.S. President Donald Trump read: ""Merry Christmas From The Winter White House.""",2021-12-06,"Former U.S. President Donald Trump sent out a 2021 ""Winter White House"" Christmas card with phallic imagery and omitted a picture of his son Barron among photos of Trump family members.",[]
8,2,politics,fact_check,Unproven, Snopes.com,https://www.snopes.com/fact-check/abortion-pills-protesters/,"Did Abortion Rights Protesters Take Abortion Pills Outside Supreme Court Building? 
Visual evidence surfaced supposedly showing four protesters outside the federal courthouse taking pills to end early pregnancies.",2021-12-02,"On Dec. 1, 2021, a group of abortion rights activists swallowed abortion pills near the U.S. Supreme Court Building to protest a court challenge that could reverse Roe vs. Wade.","['The Abortion Pill | Get the Facts About Medication Abortion. https://www.plannedparenthood.org/learn/abortion/the-abortion-pill. Accessed 2 Dec. 2021.', '‘Justices Signal They’ll OK New Abortion Limits, May Toss Roe’. AP NEWS, 1 Dec. 2021, https://apnews.com/article/abortion-donald-trump-us-supreme-court-health-amy-coney-barrett-a3b5cf9621315e6c623dc80a790842d8.']"
9,3,politics,fact_check,Mostly False, Snopes.com,https://www.snopes.com/fact-check/biden-sincerely-fauci-president/,"Did Biden Say 'Sincerely' That Fauci Is President? 
Critics of President Biden seized upon some stray remarks at a news conference in December 2021.",2021-12-03,"In December 2021, U.S. President Joe Biden sincerely stated that Anthony Fauci, and not he, was the de facto president.","['“Biden Thanks Fauci and Jokes (?) That He’s the Real President: ‘I Sincerely Mean It.’” Mediaite, 2 Dec. 2021, https://www.mediaite.com/tv/biden-thanks-fauci-and-jokes-that-hes-the-real-president-i-sincerely-mean-it/.', '  Mechbunny.com. Joe Biden Officially Admits That Dr. Fauci Is Actually President “But All Kidding aside, I Sincerely Mean It.” https://vidmax.com/video/209168-joe-biden-officially-admits-that-dr-fauci-is-actually-president-but-all-kidding-aside-i-sincerely-mean-it. Accessed 3 Dec. 2021.', '  Spiering, Charlie. “Joe Biden: ‘Who’s President? Fauci.’” Breitbart, 2 Dec. 2021, https://www.breitbart.com/politics/2021/12/02/joe-biden-whos-president-fauci/.']"
10,3,politics,fact_check,False, Snopes.com,https://www.snopes.com/fact-check/photo-biden-with-jeffrey-epstein/,"Does Photo Show Biden with Jeffrey Epstein? 
Epstein has been pictured with a number of high-profile politicians, but Joe Biden?",2021-12-03,A photograph shows U.S. President Joe Biden with convicted sex offender Jeffrey Epstein.,"['Freeman, Nate. “Wet Paint: Legendary Dealer Mary Boone Is Out of Prison Early, Jeffrey Epstein’s Little Black Book Is Full of Collectors, & More Art-World Gossip.” Artnet News, 4 June 2020, https://news.artnet.com/art-world/wet-paint-mary-boone-jail-1879428.', 'Landon Thomas Jr. “Jeffrey Epstein: International Moneyman of Mystery.” New York Magazine, 28 Oct. 2002, https://nymag.com/nymetro/news/people/n_7912/.', 'Moynihan, Colin. “Highlights From Day 4 of Ghislaine Maxwell’s Trial.” The New York Times, 2 Dec. 2021. NYTimes.com, https://www.nytimes.com/live/2021/12/02/nyregion/ghislaine-maxwell-trial.']"
11,12,politics,fact_check,Mixture, Snopes.com,https://www.snopes.com/fact-check/rittenhouse-guide/,"A Guide To Viral Rumors in the Kyle Rittenhouse Acquittal 
A viral copypasta text alleges numerous things about the teenager, his murder trial, and the people he shot. Some are more true than others.",2021-11-24,"A viral copypasta text beginning with the phrase ""I have watched the whole Rittenhouse trial"" accurately retold details of the case.","['‘Did Rittenhouse’s Grandparents Own Gas Station in Kenosha?’ Snopes.Com, https://www.snopes.com/fact-check/rittenhouse-grandparents-gas/. Accessed 22 Nov. 2021.', 'Kenosha Dumpster Fire Put out by Good Samaritain in Location Where Kyle Rittenhouse Was Attacked. www.youtube.com, https://www.youtube.com/watch?v=9csfZQku9Bw. Accessed 22 Nov. 2021.', 'Kyle Rittenhouse – The Truth in 11 Minutes. www.youtube.com, https://www.youtube.com/watch?v=E4dhPM99i4I. Accessed 22 Nov. 2021.', '‘A Look at Key Points in Kyle Rittenhouse’s Testimony’. AP NEWS, 10 Nov. 2021, https://apnews.com/article/kyle-rittenhouse-trial-key-points-bc51f3b9dd0fe0c1289fe2161d7c3ab3.', 'Press Release: Wisconsin National Guard to Support Local Law Enforcement in Kenosha. https://content.govdelivery.com/accounts/WIGOV/bulletins/29b954d. Accessed 23 Nov. 2021.', 'Sanford, Claire. ‘Kyle Rittenhouse Testimony Transcript Homicide Trial November 10’. Rev, 10 Nov. 2021, https://www.rev.com/blog/transcripts/kyle-rittenhouse-testimony-during-homicide-trial-transcript-november-10.', '‘Kyle Rittenhouse’s Friend, Dominick Black, Testifies He Bought the Gun Used in Kenosha Shootings’. Usatoday, https://www.usatoday.com/story/news/nation/2021/11/02/kyle-rittenhouse-trial-dominick-black-first-witness/6258860001/. Accessed 23 Nov. 2021.', 'Wisconsin Legislature: 948.55. https://docs.legis.wisconsin.gov/statutes/statutes/948/55. Accessed 24 Nov. 2021.', 'Sullivan, Becky. ‘The Only Person Who Survived Being Shot by Kyle Rittenhouse Takes the Stand’. NPR, 8 Nov. 2021. NPR, https://www.npr.org/2021/11/08/1053567574/kyle-rittenhouse-trial-gaige-grosskreutz-testimony-kenosha.', 'WATCH LIVE: Kyle Rittenhouse Trial for Kenosha Shooting Continues – Day 9. www.youtube.com, https://www.youtube.com/watch?v=lN9vwdEq0t0. Accessed 24 Nov. 2021.', 'Tiefenthäler, Ainara, et al. ‘Video: Reconstructing the Rittenhouse Shootings: How Kenosha Echoed America’s Polarization’. The New York Times, 28 Oct. 2021. NYTimes.com, https://www.nytimes.com/video/us/100000007409660/kyle-rittenhouse-shooting-video-analysis.html.', 'Romo, Vanessa, and Sharon Pruitt-Young. ‘What We Know about the 3 Men Who Were Shot by Kyle Rittenhouse’. NPR, 20 Nov. 2021. NPR, https://www.npr.org/2021/11/20/1057571558/what-we-know-3-men-kyle-rittenhouse-victims-rosenbaum-huber-grosskreutz.']"
12,2,politics,fact_check,False, Snopes.com,https://www.snopes.com/fact-check/child-yell-obscenity-at-jill-biden/,"Did a Child Yell an Obscenity at Jill Biden? 
The visuals of the first lady reading a story are real, but the audio ...?",2021-12-01,"A child yelled ""shut the fuck"" up at first lady Jill Biden as she read a story during a Christmas celebration.","['Boy Regales Jill Biden with Awkward Story about His Dead Hamster: ‘Let’s Move on to Happier Things.’ https://news.yahoo.com/boy-regales-jill-biden-awkward-003312709.html. Accessed 1 Dec. 2021.', '“First Lady Jill Biden Unveils White House Holiday Decorations.” ABC News, https://abcnews.go.com/Politics/lady-jill-biden-unveils-white-house-holiday-decorations/story?id=81446110. Accessed 1 Dec. 2021.']"
13,18,politics,fact_check,Correct Attribution, Snopes.com,https://www.snopes.com/fact-check/buttigieg-electric-cars-gas-prices/,"Yes, Pete Buttigieg Said Families Who Buy Electric Cars ‘Never Have To Worry about Gas Prices Again’ 
The U.S. transportation secretary was discussing the Democrats’ social spending package.",2021-11-30,"U.S. Transportation Secretary Pete Buttigieg said families that buy electric vehicles (EVs) will ""never have to worry about gas prices again.""","['Baldwin, Sara, and Hadley Tallackson. “Electric Vehicle Incentives In The Build Back Better Act.” Energy Innovation Policy and Technology LLC, Nov. 2021, https://energyinnovation.org/wp-content/uploads/2021/11/Electric-Vehicle-Incentives-in-the-Build-Back-Better-Act.pdf.', 'Breslin, Maureen. “Buttigieg: Families Who Buy Electric Vehicles ‘Never Have to Worry about Gas Prices Again.’” The Hill, 29 Nov. 2021, https://thehill.com/dem-lawmakers/583325-buttigieg-electric-vehicle-owners-never-have-to-worry-about-gas-prices-again.', '“Buttigieg Slammed for Urging Electric Car Buying to Counter Gas Prices.” New York Post, 29 Nov. 2021, https://nypost.com/2021/11/29/buttigieg-slammed-for-urging-electric-car-buying-to-counter-gas-prices/. Accessed 30 Nov. 2021.', '“Electricity in the U.S.” U.S. Energy Information Administration (EIA), https://www.eia.gov/energyexplained/electricity/electricity-in-the-us.php. Accessed 30 Nov. 2021.', '“Factors Affecting Natural Gas Prices.” U.S. Energy Information Administration (EIA), https://www.eia.gov/energyexplained/natural-gas/factors-affecting-natural-gas-prices.php. Accessed 30 Nov. 2021.', '“Frequently Asked Questions (FAQs).” U.S. Energy Information Administration (EIA), https://www.eia.gov/tools/faqs/faq.php?id=427&t=3. Accessed 30 Nov. 2021.', '“Gasoline Explained.” U.S. Energy Information Administration (EIA), https://www.eia.gov/energyexplained/gasoline/. Accessed 30 Nov. 2021.', 'Jenn, A., Lee, J., Hardman, S., & Tal, G. “An Examination of the Impact That Electric Vehicle Incentives Have on Consumer Purchase Decisions Over Time.” UC Office of the President: University of California Institute of Transportation Studies, 2019. http://dx.doi.org/10.7922/G2S46Q51 Retrieved from https://escholarship.org/uc/item/0x28831g. Accessed 30 Nov. 2021.', 'Krauss, Clifford, and Peter Eavis. “Energy Prices Spike as Producers Worry Over Pandemic and Climate.” The New York Times, 4 Oct. 2021. NYTimes.com, https://www.nytimes.com/2021/10/04/business/energy-environment/oil-and-gas-prices-clean-energy.html. Accessed 30 Nov. 2021.', '“LET THEM BUY CARS! Buttigieg Blasted for Urging Americans to Buy Electric Cars to Save on Fuel Costs.” Sean Hannity, 29 Nov. 2021, http://hannity.com/media-room/let-them-buy-cars-buttigieg-blasted-for-urging-americans-to-buy-electric-cars-to-save-on-fuel-costs/. Accessed 30 Nov. 2021.', '“Natural Gas Fuel Basics.” Alternative Fuels Data Center, https://afdc.energy.gov/fuels/natural_gas_basics.html. Accessed 30 Nov. 2021.', 'Penney, Veronica. “Electric Cars Are Better for the Planet – and Often Your Budget, Too.” The New York Times, 15 Jan. 2021. NYTimes.com, https://www.nytimes.com/interactive/2021/01/15/climate/electric-car-cost.html. Accessed 30 Nov. 2021.', 'Pramuk, Jacob. “The House Passed Biden’s Massive Social Safety Net and Climate Bill. Here’s What Happens Next.” CNBC, 19 Nov. 2021, https://www.cnbc.com/2021/11/19/house-passes-build-back-better-act-what-happens-next-in-the-senate.html. Accessed 30 Nov. 2021.', '“Prices and Factors Affecting Prices.” U.S. Energy Information Administration (EIA), https://www.eia.gov/energyexplained/electricity/prices-and-factors-affecting-prices.php. Accessed 30 Nov. 2021.', '“The Infrastructure Bill in Action.” MSNBC.Com, 28 Nov. 2021. https://www.msnbc.com/the-sunday-show/watch/the-infrastructure-bill-in-action-127353925939. Accessed 30 Nov. 2021.', 'True Cost of Electric Vehicles. https://www.aaa.com/autorepair/articles/true-cost-of-ev. Accessed 30 Nov. 2021.', 'Wayland, Michael. “EV Tax Credits in Biden’s Build Back Better Act Will Help Sell More Cars than New Chargers in Infrastructure Bill.” CNBC, 19 Nov. 2021, https://www.cnbc.com/2021/11/19/ev-tax-credits-in-bidens-build-back-better-act-will-help-sell-more-cars-than-new-chargers.html. Accessed 30 Nov. 2021.', 'Weil, Dan. “How Big Can Renewable Energy Get in the Next 10 Years?” Wall Street Journal, 12 July 2021. www.wsj.com, https://www.wsj.com/articles/renewable-energy-us-power-11626098450. Accessed 30 Nov. 2021.']"
14,3,politics,fact_check,Mostly True, Snopes.com,https://www.snopes.com/fact-check/kyle-rittenhouse-biden/,"Did Joe Biden Call Kyle Rittenhouse a 'White Supremacist'? 
The Illinois man, acquitted of murder in November 2021, alleged the president ""defamed my character.""",2021-11-24,"While on the 2020 presidential campaign trail, U.S. President Joe Biden called Kyle Rittenhouse a white supremacist.","['“Did Trump ‘Refuse to Condemn’ White Supremacists at Debate?” Snopes.Com, https://www.snopes.com/fact-check/trump-condemn-white-supremacists/. Accessed 24 Nov. 2021.', '  “Feds Won’t Seek Charges against Cop in Jacob Blake Shooting.” AP NEWS, 8 Oct. 2021, https://apnews.com/article/us-news-us-department-of-justice-rusten-sheskey-jacob-blake-kenosha-4f8493dd0776ef6046e052a538cd1460.', '  “Jury Finds Rittenhouse Not Guilty in Kenosha Shootings.” AP NEWS, 19 Nov. 2021, https://apnews.com/article/jury-finds-kyle-rittenhouse-not-guilty-in-kenosha-shootings-27f812ba532d65c044617483c915e4de.']"
15,2,politics,fact_check,False, Snopes.com,https://www.snopes.com/fact-check/biden-ron-burgundy/,"Did Biden Have a 'Ron Burgundy' Moment? 
A misleading video clip of Biden saying ""end of quote"" was widely circulated on social media.",2021-11-24,"U.S. President Joe Biden had a ""Ron Burgundy"" moment when he carelessly read something he wasn't supposed to say off a teleprompter.","['Brown, Jon. “Biden Appeared to Read ‘End of Quote’ from Teleprompter but Was Actually Quoting a Business Leader.” Fox News, 23 Nov. 2021, https://www.foxnews.com/politics/biden-appears-to-read-end-of-quote-from-teleprompter-during-gas-pricing-speech.', 'Nikki Schwab. “Joe Biden’s Awkward ‘Ron Burgundy’ Moment Is Not as It Seems.” Mail Online, 24 Nov. 2021, https://www.dailymail.co.uk/news/article-10236305/Awkward-moment-Biden-says-end-quote-reading-economics-speech.html.']"
16,3,politics,fact_check,False, Snopes.com,https://www.snopes.com/fact-check/cop-refused-service-restaurant/,"Was Black Cop Karl Baker Refused Service at a Restaurant? 
According to the story, the police officer who was refused service decided to return to the restaurant the next day while in uniform.",2021-11-22,"A Black police officer named Karl Baker was refused service on his day off at a diner in Alexandria, Virginia, so he returned the next day in uniform.","['“Cop Says ‘Violent’ Mobs of Protesters Have ‘Less Minorities’ Than Police.” The US Sun, 17 July 2020, https://www.the-sun.com/news/1155770/cop-hypocritical-violent-blm-protesters-minorities-police-clash/.', '  Foster, Fred. “Man Was Refused Food in Diner, He Came Back in Uniform to See How They Would React.” PenguinMD, 1 Aug. 2021, https://www.penguinmd.com/view/diner-refuses-serving/.', '  “Restaurant Employees Fired for Refusing to Serve Officer.” The Seattle Times, 29 July 2016, https://www.seattletimes.com/nation-world/restaurant-employees-fired-for-refusing-to-serve-officer/.']"
17,2,politics,fact_check,False, Snopes.com,https://www.snopes.com/fact-check/trump-hold-bible-upside-down/,"Did Trump Hold the Bible Upside Down? 
All eyes were on the president as he appeared for a photo-op amid widespread anti-police-brutality protests in June 2020.",2020-06-25,"U.S. President Donald Trump was photographed holding the Bible upside down outside St John's Episcopal church on June 1, 2020.","['Gjelten, Tom.   “Peaceful Protesters Tear-Gassed To Clear Way For Trump Church Photo-Op.”  \n  NPR.   01 June 2020.', '“Trump photo op was not reason for removal of protesters: Report.” \n   Al Jazeera.  10 June 2021.']"
18,0,politics,fact_check,False, Snopes.com,https://www.snopes.com/fact-check/rittenhouse-grandparents-gas/,"Did Rittenhouse's Grandparents Own Gas Station in Kenosha? 
Kyle Rittenhouse was acquitted on all charges in November 2021 in the case of a deadly protest.",2021-11-22,"Kyle Rittenhouse was defending a gas station owned by his grandparents when he shot three people during a night of civil unrest in Kenosha, Wisconsin.",[]
19,3,politics,fact_check,Unproven, Snopes.com,https://www.snopes.com/fact-check/cori-bush-ferguson/,"Did White Supremacists Shoot at Rep. Cori Bush and Ferguson Protesters? 
The Missouri Congresswoman's claims about an alleged 2015 incident were met with considerable skepticism, in November 2021.",2021-11-18,"In 2015, white supremacists shot at future U.S. Rep. Cori Bush and other anti-racism protesters, in Ferguson, Missouri.","[' ', 'Bogan, Jesse. “New Owners of Canfield Green Apartments in Ferguson Say a Pleasant View Is Coming.” STLtoday.Com, https://www.stltoday.com/news/local/metro/new-owners-of-canfield-green-apartments-in-ferguson-say-a-pleasant-view-is-coming/article_0a1b5c3d-40d1-56de-8e37-1228d9faf8ef.html. Accessed 18 Nov. 2021.', '  Suntrup, Jack. “Rep. Cori Bush Says White Supremacists Shot at Ferguson Protesters, but Chief Not Aware of Incident.” STLtoday.Com, https://www.stltoday.com/news/local/govt-and-politics/rep-cori-bush-says-white-supremacists-shot-at-ferguson-protesters-but-chief-not-aware-of/article_fbf2b08a-a49e-504b-8080-13dfb6f9f947.html. Accessed 18 Nov. 2021.']"
20,2,politics,fact_check,False,Snopes.com,https://www.snopes.com/fact-check/horse-thief-ancestor/,"Did Joe Biden Have a Horse Thief Ancestor?
Perennially circulated bit of political humor holds that a distant relative of a prominent politician was a horse thief and a train robber.",2000-10-15,A distant relative of U.S. President Joe Biden was a horse thief and a train robber.,"['    Meakes, Daryl.   Drunkcow Landmines.\n    Infinity Publishing, 2004.   0-741-42257-3   (p. 175).', '    Robertson, Ken.   “Sen. Reid’s Swinging Family Tree a Mere Web Spoof.”\n    [Kennewick] Tri-City Herald   9 January 2009.']"
