id,sources_num,category,type,legitimacy,source_name,url,title,date,text,sources
169,0,politics,fact_check,True, Snopes.com,https://www.snopes.com/fact-check/biden-justice-trump-rape-suit/,"Is Biden's DOJ Representing Trump in Defamation Case — After Biden Criticized Trump For Same Thing? 
The defamation suit filed by journalist E. Jean Carroll alleged that the former president lied about not raping her in the 1990s.",2021-06-08,"According to a brief filed on June 7, 2021, the U.S. Department of Justice under President Joe Biden is — despite Biden's criticism of the move before he was president — still seeking to defend former President Donald Trump in a defamation lawsuit brought by a journalist who accused Trump of raping her.",[]
170,0,politics,fact_check,False, Snopes.com,https://www.snopes.com/fact-check/trump-wear-pants-backwards/,"No, Trump Did Not Wear His Pants Backwards at Rally 
You asked, so we watched the 90-minute speech.",2021-06-06,"Former U.S. President Donald Trump wore his pants backwards during the June 2021 North Carolina Republican Party convention in Greenville, North Carolina.",[]
171,0,politics,fact_check,False, Snopes.com,https://www.snopes.com/fact-check/trump-reinstated-belief/,"Could Trump Be 'Reinstated' as President in August 2021? 
There is no constitutional way for this to happen.",2021-06-04,"Former U.S. President Donald Trump could be ""reinstated"" as president by August 2021.",[]
172,0,politics,fact_check,True, Snopes.com,https://www.snopes.com/fact-check/iranian-navy-ship-sink-fire-gulf/,"Did an Iranian Navy Ship Catch Fire and Sink in the Gulf? 
The Kharg was the largest warship in the Iranian navy.",2021-06-03,"The largest warship in the Iranian navy, the Kharg, caught fire and sank in the Gulf of Oman on June 2, 2021.",[]
173,0,politics,fact_check,True, Snopes.com,https://www.snopes.com/fact-check/biden-interracial-couples-tv-ads/,"Did Biden Say Interracial Couples in TV Ads Make Him 'Optimistic'? 
Social media posts highlighted the one-off comment during the president's 45-minute speech to mark the 100th anniversary of the Tulsa Race Massacre.",2021-06-03,"In a speech on June 1, 2021, to mark the 100th anniversary of the Tulsa Race Massacre, U.S. President Joe Biden cited the growing number of interracial couples appearing in contemporary television advertisements as a reason for his optimism about America's future.",[]
174,0,politics,fact_check,False, Snopes.com,https://www.snopes.com/fact-check/trump-facebook-suspension/,"Were Donald Trump's Facebook and Instagram Accounts Restored? 
Confusion ensued when people suddenly noticed that Trump's Facebook and Instagram accounts were still viewable.",2021-06-02,Former U.S. President Donald Trump's Facebook and Instagram pages are back online.,[]
175,0,politics,fact_check,False, Snopes.com,https://www.snopes.com/fact-check/military-arrest-dr-deborah-birx/,"No, the US Military Didn't Arrest Deborah Birx for Spreading COVID Lies 
We can think of a few other public figures who have spread unverified claims about the virus.",2021-06-02,"The U.S. military arrested former coronavirus response coordinator Dr. Deborah Birx on May 26, 2021, after she allegedly conspired with the Centers for Disease Control and Prevention (CDC) to “deceive the American public into believing that face masks were an effective method to mitigate the spread of Covid-19.”",[]
176,0,politics,fact_check,none, Snopes.com,https://www.snopes.com/fact-check/nancy-mace-rumor-alert/,"RUMOR ALERT: Claims that Rep. Nancy Mace Vandalized Her Own Home 
Mace's post was met with a polarized response.",2021-06-02,"U.S. Rep. Nancy Mace, R-South Carolina, vandalized her own home with spray-painted graffiti.",[]
177,0,politics,fact_check,True, Snopes.com,https://www.snopes.com/fact-check/blues-clues-pride-beaver-top-scars/,"Did Blue's Clues Pride Parade Feature a Beaver with 'Top Scars'? 
Perhaps Blue can give us some clues to solve this one.",2021-06-02,"An animated Pride parade from the Nick Jr. show ""Blue's Clues and You!"" featured a beaver with scars from top surgery.",[]
178,0,politics,fact_check,False, Snopes.com,https://www.snopes.com/fact-check/biden-tucker-carlson-white-men/,"No, Biden Did Not Say 'White Republican Men' Are 'More Dangerous Than ISIS' 
Fox News host Tucker Carlson grossly misrepresented remarks made by President Joe Biden in June 2021.",2021-06-02,"In June 2021, U.S. President Joe Biden said white Republican men were more dangerous than the Islamic State group, or words to that effect.",[]
179,0,politics,fact_check,Correct Attribution, Snopes.com,https://www.snopes.com/fact-check/kamala-harris-long-weekend/,"Did Kamala Harris Tweet 'Enjoy the Long Weekend' Before Memorial Day? 
The vice president was castigated by right-wing commentators for failing to mention the ethos behind Memorial Day, even after she did exactly that.",2021-06-01,"In 2021, U.S. Vice President Kamala Harris tweeted ""Enjoy the long weekend"" before Memorial Day.",[]
180,0,politics,fact_check,Mixture, Snopes.com,https://www.snopes.com/fact-check/mike-flynn-military-coup-myanmar/,"Did Mike Flynn Say Myanmar-Style Military Coup 'Should Happen' in US? 
The former Army general and Trump ally appeared at a right-wing conference in Texas in May 2021.",2021-06-01,"In May 2021, Michael Flynn expressed support, at least in principle, for a military coup in the United States.",[]
181,0,politics,fact_check,False, Snopes.com,https://www.snopes.com/fact-check/popeyes-drive-through-sign/,"Did Popeyes Hang a Sign Saying They Will Refuse To Serve White People? 
A sign that stirred controversy on social media triggered a police investigation.",2021-06-01,"A Popeyes restaurant in Lake Saint Louis, Missouri, hung a sign telling its customers it was under new management that would reserve the right to refuse service to white people.",[]
182,0,politics,fact_check,Mixture, Snopes.com,https://www.snopes.com/fact-check/trump-pride-month/,"Did Trump Officially Recognize Pride Month During His Presidency? 
U.S. President Bill Clinton was the first president to recognize Pride Month, in 1999.",2021-06-01,Former U.S. President Donald Trump officially recognized Pride Month during his presidency.,[]
183,0,politics,fact_check,Mostly False, Snopes.com,https://www.snopes.com/fact-check/pennsylvania-miscarriage-fine/,"Did Pennsylvania Lawmakers Vote to Fine Women Who Have a Miscarriage? 
Democratic U.S. Senate candidate Val Arkoosh condemned Pennsylvania House Bill 118 as ""unbelievable"" and ""outrageous"" in May 2021. Do her specific claims check out?",2021-05-30,"Pennsylvania House Bill 118 of 2021 would fine women who have a miscarriage, or force them to pay for a fetal death certificate.",[]
184,0,politics,fact_check,Unproven, Snopes.com,https://www.snopes.com/fact-check/north-korea-ban-skinny-jeans/,"Did North Korea Ban Skinny Jeans as a Symbol of ‘Capitalistic Lifestyle’? 
Mullets, dyed hair, and body piercings are also considered unacceptable.",2021-05-28,"The North Korean regime has banned skinny jeans, among other “Western” fashion trends, as part of a crackdown on “anti-socialist behaviour.”",[]
185,0,politics,fact_check,Unproven, Snopes.com,https://www.snopes.com/fact-check/eleanor-roosevelt-marines-quote/,"Did Eleanor Roosevelt Say Marines Have 'The Cleanest Bodies, the Filthiest Minds'? 
A popular and colorful quotation has been attributed to the former first lady for many years. Is it authentic?",2021-05-28,"Eleanor Roosevelt once said U.S. Marines have ""the cleanest bodies, the filthiest minds, the highest morale, and the lowest morals,"" or words to that effect.",[]
186,0,politics,fact_check,Correct Attribution, Snopes.com,https://www.snopes.com/fact-check/gaetz-second-amendment-comments/,"Did Matt Gaetz Say 'We Better Use' the 2nd Amendment When Discussing Social Media Companies? 
It's not the first time Gaetz has used such incendiary language.",2021-05-28,"U.S. Rep. Matt Gaetz, R-Florida, stated, ""We better use"" the Second Amendment when railing against alleged suppression of speech by social media platforms.",[]
187,0,politics,fact_check,False, Snopes.com,https://www.snopes.com/fact-check/maxine-waters-george-floyd-memorial-day/,"Is Maxine Waters Changing 'Memorial Day' to 'George Floyd Day'? 
The credibility of a rumor does not increase when placed on a colorful background.",2021-05-28,"U.S. Rep. Maxine Waters introduced a bill to rename Memorial Day to ""George Floyd Day.""",[]
188,0,politics,fact_check,False, Snopes.com,https://www.snopes.com/fact-check/did-ted-cruz-eat-a-fly/,"Did Ted Cruz Eat a Fly? 
There was a politician who swallowed a fly? I don't know why, but it's just CGI.",2021-05-28,A video shows U.S. Sen. Ted Cruz eating a fly.,[]
189,0,politics,fact_check,Mostly False, Snopes.com,https://www.snopes.com/fact-check/india-banning-twitter/,"Is India Banning Twitter? 
Social media companies reportedly are facing a new set of regulations starting May 26, 2021.",2021-05-25,"Twitter will cease operations in India on May 26, 2021.",[]
190,0,politics,fact_check,Miscaptioned, Snopes.com,https://www.snopes.com/fact-check/waco-david-chipman-photo/,"No, This Is Not a Photo of Biden's ATF Nominee David Chipman at Waco 
A photograph from the deadly siege on the Branch Davidian compound has been shared with misleading information.",2021-05-26,"A photograph shows David Chipman, U.S. President Joe Biden's ATF nominee, posing before the charred ruins of the Branch Davidian compound in Waco in 1993.",[]
191,0,politics,fact_check,False, Snopes.com,https://www.snopes.com/fact-check/joe-biden-acid-beatles/,"Did Biden Drop Acid With the Beatles? 
You'd have to be tripping to believe this story.",2021-05-26,U.S. President Joe Biden said that he once took acid with the Beatles.,[]
192,0,politics,fact_check,False, Snopes.com,https://www.snopes.com/fact-check/walmart-emails-racist-language/,"Did Customers Receive Racist Emails from Walmart? 
A slew of phony accounts resulted in emails generated using the company’s email.",2021-05-26,Customers received racist emails from Walmart.,[]
193,0,politics,fact_check,Originated as Satire, Snopes.com,https://www.snopes.com/fact-check/pope-francis-covid-vaccine-heaven/,"Did Pope Francis Say COVID-19 Vaccine Is Required To Enter Heaven? 
A vaccination card probably isn't necessary to get through the Pearly Gates.",2021-05-24,Pope Francis declared that COVID-19 vaccination would be required in order to get into heaven.,[]
194,0,politics,fact_check,True, Snopes.com,https://www.snopes.com/fact-check/yoga-ban-alabama-27-years/,"Did Alabama Lift Its 27-Year Ban on Yoga in Public Schools? 
A 1993 ban prohibited the “use of hypnosis and dissociative mental states” in public schools.",2021-05-24,"In May 2021, the state of Alabama lifted its three-decades-old ban on yoga in public schools.",[]
195,0,politics,fact_check,True, Snopes.com,https://www.snopes.com/fact-check/gretchen-whitmer-bar-photo/,"Did Gov. Gretchen Whitmer Violate Her Own COVID-19 Restrictions? 
Whitmer apologized, saying, ""I am human.""",2021-05-24,Michigan Gov. Gretchen Whitmer violated her own COVID-19 restrictions by visiting a bar and sitting at a table with a group of a dozen people.,[]
196,0,politics,fact_check,Correct Attribution, Snopes.com,https://www.snopes.com/fact-check/marjorie-taylor-greene-covid-holocaust/,"Did Marjorie Taylor Greene Liken US Congress' COVID-19 Rules to the Holocaust? 
One of the Georgia congresswoman's Republican colleagues described her remarks as ""evil lunacy.""",2021-05-24,"U.S. Rep. Marjorie Taylor Greene likened the U.S. House of Representatives' COVID-19 mitigation rules, and House Speaker Nancy Pelosi's views on them, to the worst atrocities of the Holocaust.",[]
197,0,politics,fact_check,Mostly True, Snopes.com,https://www.snopes.com/fact-check/blm-olympics-apparel-banned/,"Is BLM Apparel Banned at Tokyo Olympics? 
Political expression has been prohibited at the Olympic Games for decades.",2021-05-20,"The International Olympic Committee (IOC) banned ""Black Lives Matter"" apparel at the 2020 Olympic Games.",[]
198,0,politics,fact_check,Miscaptioned, Snopes.com,https://www.snopes.com/fact-check/kit-kat-bar-no-straight-lines-gay/,"Did Kit Kat Make 'No Straight Lines' Bar for Pride Month? 
A diagonal line is a straight line set on an angle.",2021-05-23,"A photograph shows a Kit Kat bar with ""no straight lines"" that was released in celebration of ""Gay Month.""",[]
199,0,politics,fact_check,Mostly True, Snopes.com,https://www.snopes.com/fact-check/mr-rogers-black-police-pool/,"Did Fred Rogers Invite a Black Police Officer To Join Him In a Pool? 
At that time, Black people were denied the right to swim in the same pools as white people in different parts of the U.S.",2021-05-22,"In a May 1969 episode of “Mister Rogers’ Neighborhood,” Fred Rogers invited a Black police officer to soak his feet with him in a wading pool, breaking color barriers at the time.",[]
200,0,politics,fact_check,Correct Attribution, Snopes.com,https://www.snopes.com/fact-check/anthony-bouchard-romeo-juliet/,"Did Anthony Bouchard Compare Impregnating a 14-Year-Old When He Was 18 to 'Romeo and Juliet'? 
Wyoming state Sen. Anthony Bouchard reportedly made the comment in a Facebook Live video and in statements to a local newspaper.",2021-05-21,"Wyoming state Sen. Anthony Bouchard revealed in a Facebook Live video and statements to the press that he impregnated a girl when she was 14 and he was 18 years of age, and he compared it to Shakespeare's ""Romeo and Juliet.""",[]
201,0,politics,fact_check,True, Snopes.com,https://www.snopes.com/fact-check/biden-sanction-russia-pipeline/,"Did Biden Waive Sanctions on Russia-to-Germany Pipeline? 
The move seemed at odds with previous statements made by the Biden administration.",2021-05-21,"In May 2021, U.S. President Joe Biden's administration announced it would waive some sanctions on the corporate entity and CEO overseeing the construction of Russia’s Nord Stream 2 pipeline into Germany.",[]
202,0,politics,fact_check,True, Snopes.com,https://www.snopes.com/fact-check/lego-rainbow-lgbtq-set/,"Is the Rainbow LGBTQ+ Lego Set Real? 
The sets were expected to go on sale at the start of Pride Month.",2021-05-20,Construction toy maker Lego is offering a rainbow Pride-themed set.,[]
203,0,politics,fact_check,Mostly False, Snopes.com,https://www.snopes.com/fact-check/lori-lightfoot-interviews-white-journalists/,"Did Chicago Mayor Lori Lightfoot Refuse To Give Interviews to White Journalists? 
A letter to the Chicago press on the two-year anniversary of the mayor's inauguration drew fire from conservative media.",2021-05-20,Chicago Mayor Lori Lightfoot announced she would not do interviews with white journalists.,[]
204,0,politics,fact_check,True, Snopes.com,https://www.snopes.com/fact-check/businesses-vaccinated-covid19/,"Under HIPAA Rules, Can Businesses Ask If You Have Been Vaccinated Against COVID-19? 
Where does HIPAA's privacy rule apply?",2021-05-20,Businesses can ask customers if they have been vaccinated against COVID-19 without legal repercussions.,[]
205,0,politics,fact_check,True, Snopes.com,https://www.snopes.com/fact-check/oregon-counties-vote-secede-idaho/,"Did Some Oregon Counties Vote To Secede Into Idaho? 
The ""Greater Idaho"" campaign has won a succession of electoral tests, but still faces an uphill battle.",2021-05-20,"In May 2021, voters in five Oregon counties passed ballot measures to advance a plan to secede from the state and become part of Idaho.",[]
206,0,politics,fact_check,Mostly False, Snopes.com,https://www.snopes.com/fact-check/capitol-police-statement/,"Did US Capitol Police Release a Statement on Jan. 6 Commission? 
An anonymous member of USCP, not the organization's leadership, penned this statement.",2021-05-19,"The Capitol Police released a statement expressing ""profound disappointment"" in Republican leadership's lack of support for the Jan. 6 commission.",[]
207,0,politics,fact_check,False, Snopes.com,https://www.snopes.com/fact-check/maricopa-county-elections-database/,"Was Maricopa County Elections Database Deleted? 
In May 2021, former President Donald Trump made more false claims of electoral fraud, this time linked to a Republican-led audit in Arizona.",2021-05-17,"Officials in Maricopa County, Arizona, ""deleted"" a comprehensive elections database in advance of a state senate audit in 2021.",[]
208,0,politics,fact_check,True, Snopes.com,https://www.snopes.com/fact-check/mark-mccloskey-us-senate-run/,"Did Mark McCloskey Announce He Was Running for US Senate? 
He and his wife were indicted on charges related to displaying two guns during a racial-injustice protest outside of their Missouri home in 2020.",2021-05-19,"In May 2021, Missouri lawyer Mark McCloskey announced that he would be running for U.S. Senate in the 2022 election.",[]
209,10,politics,fact_check,Unproven, Snopes.com,https://www.snopes.com/fact-check/mccloskeys-synagogue-beehives/,"Did Mark McCloskey Once Destroy a Neighboring Synagogue’s Beehives? 
Mark McCloskey and his wife, Patricia, infamously displayed two guns during a racial injustice protest outside of their Missouri mansion in 2020.",2020-09-04,"Mark McCloskey, a Missouri man made famous for brandishing a firearm at protesters in 2020, destroyed a neighboring synagogue’s beehive seven years earlier because the structures crossed his property line.","['Kohler, Jeremy.   “The St. Louis Couple Charged With Waving Guns at Protesters Have A Long History of Not Backing Down.”\n    St. Louis Post-Dispatch.   19 Aug 2020.  ', 'Eshman, Rob.   “The Rabbi Who Is Neighbor to Mark and Patricia McCloskey Speaks Out: ‘They Are Bullies.’”\n    Forward.   24 Aug 2020.  ', 'TOI Staff.   “St. Louis Couple Who Aimed Guns At Protestors Had Run-Ins With Local Synagogue”\n    The Times of Israel.   12 July 2020.  ', 'Currier, Joel.   “McCloskeys Make First Court Appearance In St. Louis Gun Case.”\n    St. Louis Post-Dispatch.   31 Aug 2020.  ', 'Siegel, Robert.   “Bees Travel Cross Country For The California Almond Harvest.”\n    NPR All Things Considered.   9 March 2017.  ', 'Melicher, Dacotah. Et al.   “Long-Distance Transportation Causes Temperature Stress in the Honey Bee, Apis mellifera.”\n    Environmental Entomology.   30 March 2019.  ', 'Melicher, Dacotah.   “Road Trip: How Hive Transportation Puts Stress on Honey Bees.”\n    Entomology Today.   1 April 2019.  ', 'Sallman, Ben.   “The Basics of Moving Hives.”\n    Bee Informed.   12 Nov 2013.  ', 'Olmos, Dori, Byers, Christine.   “McCloskeys Appear in Court on Charges, Hearing Postponed.”\n    KSDK 5 On You Side.   6 Oct. 2020  ', '2020.  “St. Louis Couple Who Pointed Guns at Protesters Plead Not Guilty to Felony Charges.”\n    CBS News.   14 Oct. 2020.  ']"
210,0,politics,fact_check,False, Snopes.com,https://www.snopes.com/fact-check/maricopa-ballots-chicken-barn-fire/,"No, Maricopa County Ballots Weren't Destroyed in a Chicken Farm Fire 
Conspiracy theories abounded during a partisan recount of Arizona's 2020 presidential election results.",2021-05-19,"November 2020 election ballots from Maricopa County, Arizona, were destroyed in a March 6, 2021, chicken barn fire.",[]
211,0,politics,fact_check,Research In Progress, Snopes.com,https://www.snopes.com/fact-check/police-10-million-arrests-2020/,"Did US Police Tally 10 Million Arrests in 2020? 
Data wasn't yet available to definitively answer the question — but the number was certainly possible.",2021-05-06,U.S. police officers documented 10 million arrests in 2020.,[]
212,0,politics,fact_check,Unproven, Snopes.com,https://www.snopes.com/fact-check/bella-hadid-anti-semitic-palestine/,"Did Bella Hadid Use Antisemitic Language at Protest for Palestine? 
The state of Israel's official Twitter account claimed the supermodel advocated “throwing Jews into the sea.”",2021-05-18,Supermodel Bella Hadid used antisemitic language equivalent to advocating “throwing Jews into the sea” during a protest for Palestinian rights.,[]
213,0,politics,fact_check,Correct Attribution, Snopes.com,https://www.snopes.com/fact-check/lea-salonga-interview/,"Did Lea Salonga Say She Was Rejected From a Role for Being Asian? 
Salonga's powerhouse vocals have made her a household name.",2021-05-18,"In an interview in 2019, Lea Salonga said she was rejected from a role because of her race.",[]
214,0,politics,fact_check,True, Snopes.com,https://www.snopes.com/fact-check/expanded-child-tax-credit-2021/,"Who is Eligible for the Expanded Child Tax Credit? 
The $1.9 trillion American Rescue Plan Act included measures to help low- to moderate-income families cover new expenses or job losses.",2021-05-18,"The COVID-19 stimulus package signed into law by President Joe Biden in March 2021 increases payments for recipients of the Child Tax Credit, and families can receive a portion of that credit in monthly installments.",[]
215,0,politics,fact_check,Unproven, Snopes.com,https://www.snopes.com/fact-check/barry-morphew-missing-wife-ballot-trump/,"Did a Man Forge His Dead Wife's Vote for Trump? 
Barry Morphew has been charged with first-degree murder in the case of his missing wife, Suzanne.",2021-05-17,"Barry Morphew, a Colorado man charged with murdering his wife, forged her mail-in ballot with a vote for former U.S. President Donald Trump in November 2020.",[]
216,0,politics,fact_check,False, Snopes.com,https://www.snopes.com/fact-check/replica-oval-office-mar-a-lago/,"Did Trump Build a Replica Oval Office at Mar-A-Lago? 
As far as we can tell, Trump's office at Mar-A-Lago is made up of right angles.",2021-05-17,Former President Donald Trump had an exact replica of the Oval Office built at Mar-A-Lago.,[]
217,0,politics,fact_check,Correct Attribution, Snopes.com,https://www.snopes.com/fact-check/ben-shapiro-settlements-rock/,"Did Ben Shapiro Tweet 'Settlements Rock' and 'Arabs Like To Bomb Crap'? 
Critics of the conservative commentator posted screenshots of an old quote, during a surge in violence between Hamas and Israel in 2021.",2021-05-16,"Ben Shapiro once wrote on Twitter ""Settlements rock"" and ""Arabs like to bomb crap and live in open sewage.""",[]
218,0,politics,fact_check,True, Snopes.com,https://www.snopes.com/fact-check/jennifer-granholm-electric-car/,"Did US Energy Secretary Say Gas Crisis ‘Would Not’ Affect Electric Car Drivers? 
Secretary of Energy Jennifer Granholm has been previously criticised for her ties to an electric car company.",2021-05-15,"On May 11, 2021, U.S. Energy Secretary Jennifer Granholm said in response to a question about a cyberattack on a pipeline that crippled fuel delivery, that “if you drive an electric car, this would not be affecting you, clearly.”",[]
219,0,politics,fact_check,True, Snopes.com,https://www.snopes.com/fact-check/jim-inhofe-behave-daddy/,"Did Sen. Inhofe Tell EPA Nominee That If She Didn’t Behave He'd ‘Talk’ to Her ‘Daddy’? 
The exchange occurred during Radhika Fox’s Senate confirmation hearing.",2021-05-15,"On May 12, 2021, U.S. Sen. Jim Inhofe told Radhika Fox, a female Environmental Protection Agency nominee for assistant administrator for the Office of Water, that “If you don't behave, I'm going to talk to your daddy.”",[]
220,0,politics,fact_check,Miscaptioned, Snopes.com,https://www.snopes.com/fact-check/christiano-ronaldo-snub-israel/,"Did Ronaldo Snub the President of Israel? 
This video was misunderstood when it first went viral in 2014.",2021-05-15,A video shows Cristiano Ronaldo snubbing the president of Israel.,[]
221,0,politics,fact_check,True, Snopes.com,https://www.snopes.com/fact-check/matt-gaetz-anti-human-trafficking/,"Was Matt Gaetz the Lone 'No' Vote on 2017 Anti-Human Trafficking Bill? 
As U.S. Rep. Matt Gaetz faced a Justice Department investigation, his past voting record came under fresh scrutiny. ",2021-05-15,U.S. Rep. Matt Gaetz was the lone “nay” vote against the 2017 Combating Human Trafficking in Commercial Vehicles Act.,[]
222,0,politics,fact_check,Mixture, Snopes.com,https://www.snopes.com/fact-check/rand-paul-right-about-masks/,"Was Rand Paul ‘Right’ All Along About the CDC Mask Mandate? 
The U.S. senator rejoiced at revised guidelines allowing fully vaccinated people to relax mask wearing during the COVID-19 pandemic.",2021-05-14,"U.S. Sen. Rand Paul was right about unmasking before the Centers for Disease Control and Prevention (CDC) announced on May 13, 2021, that fully vaccinated people no longer need to mask in public or private.",[]
223,0,politics,fact_check,True, Snopes.com,https://www.snopes.com/fact-check/glasgow-protesters-surround-van/,"Did Glasgow Protest Force Release of Indian Immigrants? 
Internet users enthusiastically shared stirring scenes from a May 2021 protest against the detention of two Indian immigrants living in Scotland.",2021-05-14,"In May 2021, protesters in Glasgow, Scotland, forced the release of two Indian men detained by Immigration Enforcement officers.",[]
224,0,politics,fact_check,Correct Attribution, Snopes.com,https://www.snopes.com/fact-check/120-retired-admirals-letter/,"Did 124 Retired Admirals and Generals Sign Letter Questioning 2020 Election? 
The letter received harsh criticism from other military leaders for being ""anti-democratic.""",2021-05-13,One hundred twenty-four retired admirals and generals signed a letter questioning the validity of the 2020 election and U.S. President Joe Biden's mental acuity.,[]
225,0,politics,fact_check,False, Snopes.com,https://www.snopes.com/fact-check/aoc-twins-18-months/,"No, AOC Didn't Say Pregnancy Lasts 18 Months When Having Twins 
A great way to make someone look more ignorant than they actually are is to pretend they said things they never said.",2021-05-13,"Rep. Alexandria Ocasio-Cortez said ""I hope I never have twins because I can't afford to be pregnant for 18 months.""",[]
