id,sources_num,category,type,legitimacy,source_name,url,title,date,text,sources
985,0,politics,fact_check,Correct Attribution, Snopes.com,https://www.snopes.com/fact-check/cornyn-votes-puerto-rico/,"Did Sen. Cornyn Tweet About 'Thousands of Uncounted Votes in Puerto Rico'? 
Social media users ridiculed the Texas senator for tweeting about uncounted votes in Puerto Rico.",2020-11-16,"U.S. Sen. John Cornyn of Texas tweeted about uncounted ballots in Puerto Rico as an example of example of ""why it is prudent to let the process run its course"" in the 2020 U.S. presidential election.",[]
986,0,politics,fact_check,Mixture, Snopes.com,https://www.snopes.com/fact-check/biden-cancer-charity/,"Did Biden's Cancer Charity Spend Millions on Salaries and Nothing on Research? 
Sometimes disinformation states the facts correctly but frames them misleadingly.",2020-11-16,The Biden Cancer Initiative spent millions on salaries but nothing on cancer research.,[]
987,0,politics,fact_check,Unproven, Snopes.com,https://www.snopes.com/fact-check/maga-trump-million-march/,"Did 'More Than One Million' People Attend a Pro-Trump 'MAGA March' in D.C.? 
Crowd sizes are notoriously difficult to estimate, but let's take a look.",2020-11-16,"More than one million people took part in a pro-Donald Trump march in Washington, D.C., on Nov. 14, 2020.",[]
988,0,politics,fact_check,Mixture, Snopes.com,https://www.snopes.com/fact-check/california-unlawful-ballots/,"Did California Issue 'Unlawful' Mail-In Ballots? 
A ruling from a Sutter County judge said an executive order issued by California Gov. Gavin Newsom was ""void"" and ""unconstitutional.""",2020-11-16,"The state of California issued ""unlawful"" mail-in ballots, and the outcome of the 2020 U.S. presidential election is in jeopardy.",[]
989,0,politics,fact_check,Correct Attribution, Snopes.com,https://www.snopes.com/fact-check/obama-trump-transition-letter/,"Did Obama Write 'We're Just Temporary Occupants' to Trump in Transition Letter? 
There is a long history of outgoing presidents leaving letters to their successors.",2020-11-16,"Outgoing U.S. President Barack Obama wrote that ""we're just temporary occupants of this office"" in a letter to President Donald Trump during the 2016 White House transition.",[]
990,0,politics,fact_check,Correct Attribution, Snopes.com,https://www.snopes.com/fact-check/huckabee-letter-biden-fraud/,"Did Mike Huckabee Write a 'Letter to Biden' About 'Voter Fraud'? 
Supporters of outgoing U.S. President Donald Trump enthusiastically shared a letter attributed to the former Arkansas governor.",2020-11-16,"An open letter to Joe Biden about ""voter fraud,"" in November 2020, was written by Mike Huckabee.",[]
991,0,politics,fact_check,Mixture, Snopes.com,https://www.snopes.com/fact-check/newsmax-biden-pence/,"Did a Newsmax Story Say Trump Should 'Retire Immediately'? 
The suggestion shocked many Newsmax readers.",2020-11-16,"The conservative news website Newsmax published a column that suggested U.S. President Donald Trump should ""retire immediately,"" letting Vice President Mike Pence handle the transition to the incoming Biden-Harris administration.",[]
992,0,politics,fact_check,True,Snopes.com,https://www.snopes.com/fact-check/rnc-chairwoman-deleted-tweet/,"Did RNC Chairwoman Delete a Tweet Suggesting Biden Won?
Two days later the chair tweeted a new and very different message.",2020-11-16,Republican National Committee Chairwoman Ronna McDaniel published and later deleted a tweet that suggested a U.S. future under a Joe Biden-Kamala Harris presidential administration.,[]
993,0,politics,fact_check,none, Snopes.com,https://www.snopes.com/fact-check/rumor-alert-dominion-voting-systems-fraud-claims/,"RUMOR ALERT: Dominion Voting Systems Fraud Claims 
Isolated incidents that were quickly rectified were used to imply widespread voter fraud was occurring in 2020.",2020-11-08,Various rumors alleging voter fraud focused on the Electronic voting company Dominion Voting Systems.,[]
994,0,politics,fact_check,, Snopes.com,https://www.snopes.com/fact-check/raising-canes-chicken-bankruptcy/,"Did Raising Cane's Chicken File for Bankruptcy? 
Word spread quickly on Twitter and TikTok that the company was purportedly facing financial hardship.",2020-11-15,,[]
995,0,politics,fact_check,Mostly True, Snopes.com,https://www.snopes.com/fact-check/deutsche-bank-tweet/,"Did Deutsche Bank Fund Auschwitz, Trump, Jeffrey Epstein, and ISIS? 
The suggestion that working from home is a ""privilege"" led some on social media to dig into the bank's past.",2020-11-13,"Deutsche Bank ""funded"" Auschwitz, Donald Trump, Jeffery Epstein, and ISIS.",[]
996,0,politics,fact_check,Mixture, Snopes.com,https://www.snopes.com/fact-check/truckers-strike-thanksgiving/,"Are US Truckers Planning a Nationwide Strike Over Thanksgiving? 
Organizing large-scale strikes ranges from difficult to nearly impossible for the trucking industry in its current form.",2020-11-13,"From Nov. 26 to 29, 2020, U.S. truckers will carry out a nationwide protest against the election of Joe Biden and his policies that they say will hurt blue-collar workers including those in their industry.",[]
997,0,politics,fact_check,Correct Attribution, Snopes.com,https://www.snopes.com/fact-check/melania-christmas-recording/,"Did Melania Trump Say 'Who Gives a F*ck about Christmas Stuff'? 
The quote reportedly was featured in a secretly recorded discussion between Melania Trump and Stephanie Winston Wolkoff, a former top aide to the first lady.",2020-11-13,"In a July 2018 audio recording, first lady Melania Trump can be heard saying: ""Who gives a fuck about Christmas stuff and decoration?""",[]
998,0,politics,fact_check,Mixture, Snopes.com,https://www.snopes.com/fact-check/biden-306-electoral-votes/,"Do Biden's 306 Electoral Votes Match Trump's Total in 2016? 
In 2016, U.S. President Donald Trump called his 306 electoral votes a ""landslide"" victory.",2020-11-13,"President-elect Joe Biden won 306 Electoral College votes, the same total President Donald Trump won in 2016.",[]
999,0,politics,fact_check,True, Snopes.com,https://www.snopes.com/fact-check/kamala-harris-montel-williams/,"Do Photos Show Kamala Harris With Montel Williams? 
The former talk show host questioned whether the media would focus on Harris' dating history if she were a man.",2020-11-13,Photographs show Kamala Harris and talk show host Montel Williams on the red carpet in 2001.,[]
1000,0,politics,fact_check,False, Snopes.com,https://www.snopes.com/fact-check/dominion-deleted-trump-votes/,"Did Dominion Voting Systems Delete 2.7M Trump Votes? 
The president of the United States continues to spread debunked claims of voter fraud.",2020-11-13,Dominion Voting Systems deleted 2.7 million votes that were cast for U.S. President Donald Trump in 2020.,[]
1001,0,politics,fact_check,Mixture, Snopes.com,https://www.snopes.com/fact-check/pennsylvania-judge-legal-win-trump/,"Did a Pennsylvania Judge Rule Out Some Mail-In Ballots? 
A viral YouTube video claimed: ""TRUMP TEAM WIN: MAJOR Legal Win For President Trump IN PENNSYLVANIA.""",2020-11-13,"A Pennsylvania judge ruled that some mail-in ballots would be disqualified, scoring a major legal win for U.S. President Donald Trump in the 2020 presidential election.",[]
1002,0,politics,fact_check,False, Snopes.com,https://www.snopes.com/fact-check/melania-trump-last-christmas/,"Did Melania Trump Say 2020 Would Be Her Last Christmas in the White House? 
As of this writing, the world is still waiting for U.S. President Donald Trump and the first lady to concede the election.",2020-11-13,First lady Melania Trump put out a statement in November 2020 saying this would be her final Christmas in the White House.,[]
1003,0,politics,fact_check,True, Snopes.com,https://www.snopes.com/fact-check/stop-the-steal-gay-communists/,"Was a 'Stop The Steal' Facebook Group Renamed 'Gay Communists for Socialism'? 
The group had gained well over 64,000 members in its brief 24 hours of existence.",2020-11-06,A pro-Trump Facebook group called Stop The Steal was renamed Gay Communists for Socialism.,[]
1004,0,politics,fact_check,False, Snopes.com,https://www.snopes.com/fact-check/quantum-blockchain-watermark-vote/,"Did Mail-in Ballots Secretly Contain Quantum Blockchain Watermarks? 
Don't feel bad if you've never heard of quantum blockchain systems.",2020-11-12,"As part of a sting operation to prevent voter fraud, the government added either a ""QFS watermark"" or a ""quantum blockchain watermark"" to mail-in ballots that will one day reveal U.S. President Donald Trump as the true winner of the 2020 presidential election.",[]
1005,0,politics,fact_check,False, Snopes.com,https://www.snopes.com/fact-check/everylegalvote-2020-election/,"Does Everylegalvote.com Show Impact of Voter Fraud on 2020 Elections? 
A website presenting itself as an educational tool on the integrity of U.S. elections bases its extrapolations on debunked rumors and hoaxes.",2020-11-12,The website everylegalvote.com provides empirical evidence that U.S. President Donald Trump would have won the 2020 general election were it not for voter fraud.,[]
1006,0,politics,fact_check,False, Snopes.com,https://www.snopes.com/fact-check/did-joe-frazier-vote-pa/,"Did Boxing Champ Joe Frazier Vote 'From His Grave'? 
Arguably, scarier things have happened in 2020.",2020-11-12,"One or more people used the identity of American boxer Joe Frazier, who died in 2011, to illegally vote in Philadelphia.",[]
1007,0,politics,fact_check,Mixture,Snopes.com,https://www.snopes.com/fact-check/georgia-runoff-residency/,"Were Dems Urged To 'Fake Residency' & Vote in Georgia Senate Election?
Allegations of ""leftists"" encouraging ""voter fraud"" spread in right-wing media ahead of the Georgia runoff elections.",2020-11-12,"Democrats publicly encouraged voters living outside of Georgia to temporarily move to the state and commit ""voter fraud"" by voting in the Georgia runoff.",[]
1008,0,politics,fact_check,False, Snopes.com,https://www.snopes.com/fact-check/ballots-video-voter-fraud-trump/,"Does This Ballot Collection Video Show Voter Fraud? 
U.S. President Donald Trump did accurately point out the video showed ""BALLOTS!"" But any insinuation that it documented illegal activity was false.",2020-11-11,A video shows the illegal collection of ballots for the 2020 election in California.,[]
1009,0,politics,fact_check,True, Snopes.com,https://www.snopes.com/fact-check/ivanka-trump-alaska-win/,"Did Ivanka Celebrate News Media Projecting Trump's Alaska Win? 
Some called out Trump's eldest daughter for celebrating the AP's Alaska call, while ignoring the same outlet's calling the election overall for Joe Biden.",2020-11-11,"U.S. President Donald Trump's daughter and White House adviser, Ivanka Trump, celebrated the Associated Press' calling Alaska for her father in the 2020 election, after the president questioned why news media make such calls when the overall election wasn't going in his favor.",[]
1010,0,politics,fact_check,Mostly True, Snopes.com,https://www.snopes.com/fact-check/smooth-transition-trump/,"Did Mike Pompeo Promise a 'Smooth Transition to 2nd Trump Administration'? 
He's America's top diplomat heading a department that advocates for free and fair elections in foreign countries.",2020-11-11,"On Nov. 10, 2020, U.S. Secretary of State Mike Pompeo said ""there will be a smooth transition to a second Trump administration.""",[]
1011,0,politics,fact_check,Mixture, Snopes.com,https://www.snopes.com/fact-check/kamala-harris-legalize-prostitution/,"Does Kamala Harris Want To Legalize Prostitution? 
The vice president-elect’s stance on sex work is more complicated than what’s depicted in one interview.",2020-11-11,"In a February 2019 interview, then-U.S. Sen. Kamala Harris called for the legalization of prostitution.",[]
1012,0,politics,fact_check,True, Snopes.com,https://www.snopes.com/fact-check/trump-accuse-cruz-fraud/,"Did Trump Accuse Sen. Ted Cruz of Fraud in 2016? 
President Donald Trump has accused several of his political opponents of fraud over the years.",2020-11-11,U.S. President Donald Trump accused U.S. Sen. Ted Cruz of fraud on Twitter after coming in second during the 2016 Iowa caucus.,[]
1013,0,politics,fact_check,False, Snopes.com,https://www.snopes.com/fact-check/legislatures-override-electors/,"Can State Legislatures Override the Choice of Presidential Electors? 
The electoral college is a unique system for indirectly electing the president of the United States.",2020-11-06,State legislatures can override the results of elections and designate whichever presidential electors they choose.,[]
1014,0,politics,fact_check,True, Snopes.com,https://www.snopes.com/fact-check/republican-dean-browning-gay/,"Did Republican Dean Browning Tweet 'I'm a Black Gay Guy'? 
Twitter users believed the tweet was meant to go out via an alternate, fake account to bolster support for Republican causes.",2020-11-10,"Dean Browning, a white man who previously ran and lost in the 2020 Republican primary for U.S. House Pennsylvania District 7, tweeted, ""I'm a black gay guy"" from his verified Twitter account.",[]
1015,0,politics,fact_check,False, Snopes.com,https://www.snopes.com/fact-check/biden-president-elect-office/,"Did Biden Create 'Office of the President Elect' To Undermine Trump? 
Not everything U.S. President-elect Joe Biden does is a scheme against the current president.",2020-11-10,"U.S. President-elect Joe Biden created the ""Office of the President Elect"" to convince Americans the 2020 elections results were final when they weren't.",[]
1016,0,politics,fact_check,False, Snopes.com,https://www.snopes.com/fact-check/georgia-ballots-likely-ineligible/,"Are 132K Ballots in Georgia Likely Ineligible? 
This appeared to be an example of what we'll call a ""misinformation ouroboros"" endless loop.",2020-11-10,"In Fulton County, Georgia, 132,000 ballots are ""highly likely"" to be ineligible.",[]
1017,0,politics,fact_check,Misattributed, Snopes.com,https://www.snopes.com/fact-check/colin-powell-lazy-immigrants/,"Did Colin Powell Make Viral Remarks About 'Lazy Immigrants' and White Hypocrisy? 
Placing words next to a picture of a man is not the same as the man's writing those words himself.",2020-11-10,"The quote, ""I don't want to hear about 'lazy immigrants' from a race of people who enslaved a whole other race of people to do all the work they didn't want to do"" is attributed to former U.S. Secretary of State Colin Powell.",[]
1018,0,politics,fact_check,Correct Attribution, Snopes.com,https://www.snopes.com/fact-check/trump-stimulus-package-election/,"Did Trump Promise 'Tremendous Stimulus Package Immediately After the Election'? 
The IRS sent out the first payments in April 2020, and American families have been awaiting word on when a second stimulus check may be coming.",2020-11-10,"On Oct. 30, 2020, U.S. President Donald Trump said: ""We will have a tremendous stimulus package immediately after the election.""",[]
1019,0,politics,fact_check,False, Snopes.com,https://www.snopes.com/fact-check/trump-art-of-the-deal/,"Did Trump Write 'Never Admit Defeat' in 'Art of the Deal'? 
While President Trump may never admit defeat, he did not write that in ""The Art of the Deal.""",2020-11-10,"A passage from chapter 45 of U.S. President Donald Trump's book ""The Art of the Deal"" reads: ""Never admit defeat. You win. If you don't win claim they cheated. They rigged it. They stole it.""",[]
1020,0,politics,fact_check,False, Snopes.com,https://www.snopes.com/fact-check/real-clear-politics-biden/,"Did Real Clear Politics Take Penn. 'Away' From Biden After Lawsuit News? 
It is challenging to take something away that was never given in the first place.",2020-11-10,"Media outlet Real Clear Politics projected Joe Biden to win Pennsylvania in the 2020 U.S. presidential election but rescinded that call after news of a lawsuit that could ""invalidate 300,000 or more"" Democratic votes.",[]
1021,0,politics,fact_check,False, Snopes.com,https://www.snopes.com/fact-check/hammer-scorecard-vote-counts/,"Is There a 'Hammer and Scorecard' Operation to Manipulate Vote Counts? 
The director of the U.S. Cybersecurity and Infrastructure Security Agency (CISA) called the rumors ""nonsense.""",2020-11-09,"A supercomputer called ""Hammer"" and a software program called ""Scorecard"" are being used to alter vote counts in the U.S. presidential election of 2020.",[]
1022,0,politics,fact_check,False, Snopes.com,https://www.snopes.com/fact-check/biden-fraud-ballots-count/,"Does Biden Want Fraudulent Ballots To Count in the 2020 Election? 
The baseless claim suggests the president-elect has ordered elections workers nationwide to break laws governing vote counting.",2020-11-09,"President-elect Joe Biden's campaign directed elections officials to consider ballots valid even if they are fake, manipulated, or cast by ineligible or deceased voters.",[]
1023,0,politics,fact_check,True, Snopes.com,https://www.snopes.com/fact-check/trump-legal-team-four-seasons/,"Did Trump's Legal Team Hold a News Conference at Four Seasons Total Landscaping? 
Questions swirled over whether the wrong Four Seasons was the site of the conference.",2020-11-09,A Rudy Giuliani news conference falsely claiming mass voter fraud in the 2020 presidential election was held at Four Seasons Total Landscaping instead of the Four Seasons Hotel.,[]
1024,0,politics,fact_check,Unproven, Snopes.com,https://www.snopes.com/fact-check/biden-hat-trump-maga/,"Was Biden’s Hat a Response to Trump’s MAGA Slogan? 
Internet sleuths think the president-elect is trolling Trump with a “We Just Did” hat.",2020-11-09,"U.S. President-elect Joe Biden’s hat answers Donald Trump’s campaign slogan “Make America Great Again” with the phrase, “We Just Did.”",[]
1025,0,politics,fact_check,True, Snopes.com,https://www.snopes.com/fact-check/kanye-west-receive-60000-votes/,"Did Kanye West Receive 60K Votes for US President? 
West conceded his presidential bid on Election Day, but it may not be the last time we see him on the ballot.",2020-11-05,"A Facebook post sharing screenshots of state-by-state vote counts taken on Nov. 4, 2020, showed rapper Kanye West as having garnered tens of thousands of presidential votes in the general election.",[]
1026,0,politics,fact_check,Mixture, Snopes.com,https://www.snopes.com/fact-check/harris-first-poc-vp/,"Will Kamala Harris Be the First POC as Vice President? 
Kamala Harris will be the first woman and the first woman of color to serve as vice president, but not the first person of color.",2020-11-08,Kamala Harris will be first person of color to serve as vice president.,[]
1027,0,politics,fact_check,Mostly False, Snopes.com,https://www.snopes.com/fact-check/william-bradley-voted-dead/,"Was the Ballot of Deceased Man Named William Bradley Counted in Michigan? 
During the 2020 presidential contest, false information on the internet spread faster than facts.",2020-11-07,The ballot of an 118-year-old deceased man named William Bradley was counted in Michigan.,[]
1028,0,politics,fact_check,True,Snopes.com,https://www.snopes.com/fact-check/2020-presidential-winner-announced/,"Who Won the Election?
For days, the world waited to see who American voters want to serve as the 46th president of the United States — Donald Trump or Joe Biden.",2020-11-07,The winner of the 2020 U.S. presidential has been announced.,[]
1029,0,politics,fact_check,True, Snopes.com,https://www.snopes.com/fact-check/golfing-trump-election-results/,"Was Trump Golfing When the 2020 Presidential Election Was Called? 
On an historic day in America, rumors held that the incumbent president spent the key moment on a golf course.",2020-11-07,U.S. President Donald Trump was golfing when Joe Biden was projected as the winner of the 2020 presidential election.,[]
1030,0,politics,fact_check,False, Snopes.com,https://www.snopes.com/fact-check/atlanta-georgia-voter-fraud-video/,"Does Viral Video Show Voter Fraud in Atlanta, Georgia? 
According to the Fulton County elections director, a poll worker allegedly seen discarding a ballot in the video has had to go into hiding because of threats of violence.",2020-11-05,"A widely shared video of a vote-count worker in Atlanta, Georgia, is definitive proof of electoral fraud in the aftermath of the 2020 U.S. presidential election.",[]
1031,0,politics,fact_check,False, Snopes.com,https://www.snopes.com/fact-check/jorgensen-40k/,"Did Libertarian Candidate Jo Jorgensen Lose 40K Votes in 10 Minutes in Pennsylvania? 
And if so, where did they go?",2020-11-06,"Jo Jorgensen, the Libertarian candidate in the 2020 U.S. presidential election, lost over 40,000 votes in 10 minutes as votes were being counted in Pennsylvania.",[]
1032,0,politics,fact_check,False, Snopes.com,https://www.snopes.com/fact-check/dhs-watermark-sting/,"Did DHS Secretly Watermark Ballots in an Election Fraud Sting Against Dems? 
Discussing election mechanics is easier when you actually know how elections work.",2020-11-06,The U.S. Department of Homeland Security orchestrated a sting against Democrats by adding a secret watermark to prove their participation in election fraud.,[]
1033,0,politics,fact_check,Unproven, Snopes.com,https://www.snopes.com/fact-check/ghost-voters-in-29-states/,"Do Hundreds of Counties Have 1.8 Million 'Ghost Voters' in the US? 
A study published by the activist legal group Judicial Watch used two different types of data to make a comparison.",2020-11-06,"Hundreds of counties in the U.S. have 1.8 million ""ghost voters"" registered to vote.",[]
1034,0,politics,fact_check,Correct Attribution, Snopes.com,https://www.snopes.com/fact-check/bannon-fauci-wray-head-pikes/,"Did Bannon Say He’d Put Fauci’s and FBI Director Wray's 'Heads on Pikes'? 
The podcaster and Breitbart executive has been described as a ""Trump loyalist.""",2020-11-06,"Former U.S. President Donald Trump campaign adviser Steve Bannon called for a ""second term"" to kick off with the firings of NIH Director Dr. Anthony Fauci and FBI Director Christopher Wray, adding that he would put their ""heads on pikes"" as a warning.",[]
1035,0,politics,fact_check,True, Snopes.com,https://www.snopes.com/fact-check/recurring-donation-dec/,"Is Trump Campaign Auto-Checking A ""Recurring Donation"" Option That Ends in December? 
The campaign website, until recently, had been accepting recurring donations up until Election Day.",2020-11-06,The Trump Campaign's fundraising platform is soliciting recurring donations until mid-December and automatically checking the box that authorizes this option.,[]
1036,0,politics,fact_check,Correct Attribution, Snopes.com,https://www.snopes.com/fact-check/biden-black-athletes-green-mile/,"Did Biden Liken Playing Ball with Black Athletes to 'The Green Mile'? 
The film ""The Green Mile"" highlights the disparity between the sentencing and treatment of white and Black penitentiary inmates during the Great Depression.",2020-11-03,"In a Nov. 3, 2020 interview with reporters in Wilmington, Delaware, U.S. Democratic presidential candidate Joe Biden likened his experiences playing ball with Black athletes to Stephen King’s Green Mile.",[]
1037,0,politics,fact_check,Miscaptioned, Snopes.com,https://www.snopes.com/fact-check/detroit-wagon-ballots/,"This Video Does Not Show a Ballot Box Being Sneaked Into a Detroit Counting Facility 
Even the most innocuous actions can be made to seem sinister when presented with a healthy heap of paranoia.",2020-11-06,A video captures a ballot box being furtively delivered to a Detroit counting center under cover of darkness.,[]
1038,0,politics,fact_check,False, Snopes.com,https://www.snopes.com/fact-check/ballots-lancaster-pa/,"Did Lancaster County Count More Mail-in Ballots Than It Received? 
A flawed graphic on a local news program is not compelling evidence of widespread fraud.",2020-11-05,"In the 2020 U.S. presidential election, Lancaster County, Pennsylvania, counted more mail-in ballots than it actually received.",[]
1039,0,politics,fact_check,False, Snopes.com,https://www.snopes.com/fact-check/missing-votes-trump-california/,"Are 9.7M Votes for Trump Missing in California? 
False conspiracy theories following the 2020 election continue to spread on social media.",2020-11-05,Some 9.7 million votes for U.S. President Donald Trump's reelection were missing in California in November 2020.,[]
1040,0,politics,fact_check,False, Snopes.com,https://www.snopes.com/fact-check/80-trump-ballots-burned/,"Were 80 Trump Ballots Burned? 
U.S. President Donald Trump's son Eric shared a deceptive video about allegations of fraud.",2020-11-05,A video shows 80 ballots cast for U.S. President Donald Trump being burned.,[]
1041,0,politics,fact_check,False,Snopes.com,https://www.snopes.com/fact-check/fairfax-gave-biden-extra-votes/,"Voter Fraud Rumor: Fairfax County Didn't Give Biden 100,000 Extra Votes
A quickly corrected clerical error was exploited to further yet another false claim about voter fraud after the 2020 election.",2020-11-05,"Fairfax County, Virginia, ""gave"" U.S. 2020 Democratic presidential candidate Joe Biden an extra 100,000 votes.",[]
1042,0,politics,fact_check,False,Snopes.com,https://www.snopes.com/fact-check/voter-fraud-more-votes-voters-2020/,"Voter Fraud Rumor: 7 States Did Not Count More Votes Than Voters
Outdated statistics were used to spread false claims about voter fraud in 2020.",2020-11-05,An image graphic shows that seven U.S. states counted more votes than registered voters.,[]
