id,sources_num,category,type,legitimacy,source_name,url,title,date,text,sources
567,0,politics,fact_check,True, Snopes.com,https://www.snopes.com/fact-check/rush-limbaugh-mock-aids-gays/,"Did Rush Limbaugh's 'AIDS Update' Mock the Deaths of Gay People? 
Limbaugh would later say he regretted the segment as it made fun of people who were dying excruciating deaths.",2021-02-17,"Radio host Rush Limbaugh had an ""AIDS Update"" segment that mocked the deaths of gay people.",[]
568,0,politics,fact_check,Misattributed, Snopes.com,https://www.snopes.com/fact-check/limbaugh-thank-trump-letter/,"Did Limbaugh Thank Trump 'For the Last 4 Years' in an Open Letter? 
The controversial radio personality received the Presidential Medal of Freedom from President Donald Trump in January 2020.",2021-02-17,"Radio host Rush Limbaugh penned an open letter thanking U.S. President Donald Trump that began: ""My days on earth are numbered.""",[]
569,0,politics,fact_check,Mostly False, Snopes.com,https://www.snopes.com/fact-check/harris-protesters-bail/,"Did Kamala Harris Bail Out 'Violent Rioters' During George Floyd Protests? 
The claim appeared to stem from a June 2020 tweet from Harris.",2021-02-16,"During protests over the police in-custody death of George Floyd in the summer of 2020, Kamala Harris donated money to a Minnesota nonprofit that helped protesters who were arrested get out of jail and break more laws.",[]
570,0,politics,fact_check,Mostly False, Snopes.com,https://www.snopes.com/fact-check/aoc-capitol-attack/,"Did AOC Exaggerate the Danger She Was in During Capitol Riot? 
AOC was targeted with another round of bad-faith smears after giving an emotional, firsthand account of her experiences during the Capitol riot.",2021-02-03,"Alexandria Ocasio-Cortez exaggerated the danger she was in during the Jan. 6, 2021, Capitol riot, in that she ""wasn't even in the Capitol building"" when the rioting occurred.",[]
571,0,politics,fact_check,Mixture, Snopes.com,https://www.snopes.com/fact-check/parler-russia/,"Is Parler Being Supported by a Russian Company? 
After Parler went offline following a deadly attack on the U.S. Capitol, rumors surfaced that the website returned with help from a Russian firm.",2021-01-20,The social media platform Parler came back online in January 2021 with support from a Russian company.,[]
572,0,politics,fact_check,True, Snopes.com,https://www.snopes.com/fact-check/warnock-arrested-capitol-praying/,"Was Raphael Warnock Arrested at the Capitol in 2017? 
A photo of police surrounding Warnock at the U.S. Capitol drew comparisons to violent pro-Trump riots on Jan. 6, 2021.",2021-01-08,Rev. Raphael Warnock was arrested while praying during a demonstration at the U.S. Capitol in 2017.,[]
573,0,politics,fact_check,Mostly False,Snopes.com,https://www.snopes.com/fact-check/biden-aid-vietnam-refugees/,"Did Biden Block Giving Aid & Admittance to Vietnamese Refugees in 1975?
Donald Rumsfeld’s book about the Ford administration, “When the Center Held,” recounts an interaction with then-Senator Joe Biden.",2021-02-16,"In 1975, then-U.S. Sen. Joe Biden blocked aid to South Vietnam and did not allow admittance of Vietnamese refugees into the United States.",[]
574,0,politics,fact_check,Misattributed, Snopes.com,https://www.snopes.com/fact-check/lewis-old-devils-letter-young/,"Did C.S. Lewis Write This ′Old Devil's Letter to the Young'? 
What does a 1942 book have to tell us about a 21st century pandemic? Nothing.",2021-02-16,A passage about souls being led to Hell by their fear of disease was taken from a work by C.S. Lewis.,[]
575,0,politics,fact_check,Mixture, Snopes.com,https://www.snopes.com/fact-check/woman-suing-gorilla-glue-hair/,"Is a Woman Suing Gorilla Glue After She Put It in Her Hair? 
An apparent mishap involving Gorilla Glue applied to a Louisiana woman's hair went viral — but also resulted in a world of pain.",2021-02-09,A woman is seeking medical help and suing the manufacturer after she sprayed Gorilla Glue in her hair.,[]
576,0,politics,fact_check,Mostly False, Snopes.com,https://www.snopes.com/fact-check/biden-energy-independence/,"Did Biden Set US 'Back 50 Years' on Energy Independence Progress? 
It is true that 2019 was the first year since 1957 in which the U.S. was energy independent.",2021-02-15,"After only 10 days in office, Joe Biden sent the United States ""back 50 years"" on its progress toward energy independence.",[]
577,0,politics,fact_check,none, Snopes.com,https://www.snopes.com/fact-check/pressley-panic-buttons/,"Were Panic Buttons Removed From Democratic Lawmaker's Office Prior to Insurrection? 
The circumstances under which the buttons were allegedly ""torn out"" of U.S. Rep. Ayanna Pressley's office were unknown.",2021-01-14,"Emergency panic buttons were inexplicably removed from U.S. Rep. Ayanna Pressley's Capitol suite before the Jan. 6 insurrection, possibly as part of a conspiracy against her.",[]
578,0,politics,fact_check,Labeled Satire, Snopes.com,https://www.snopes.com/fact-check/kamala-harris-va-facilities/,"No, Kamala Harris Did Not Tell Veterans 'Get a Job' 
A meme involving Kamala Harris and the Department of Veterans Affairs originally came from a purported ""satire"" site.",2021-02-15,U.S. Vice President Kamala Harris announced plans to cut funding to the Veterans Administration (VA) by shuttering VA facilities.,[]
579,0,politics,fact_check,True, Snopes.com,https://www.snopes.com/fact-check/george-floyd-valentine/,"Are LAPD Officers Under Investigation for Sharing Racist George Floyd 'Valentine'? 
The alleged post included a photo of Floyd with the caption, ""You take my breath away.""",2021-02-15,"In mid-February 2021, the Los Angeles Police Department announced an investigation into reports that officers were passing around a photo of George Floyd with the caption, “You take my breath away.""",[]
580,0,politics,fact_check,Labeled Satire, Snopes.com,https://www.snopes.com/fact-check/aoc-ban-pledge-allegiance/,"No, AOC and Ilhan Omar Aren't Banning the Pledge of Allegiance 
A routine review of content labeled satire.",2021-02-15,U.S. Reps. Alexandria Ocasio-Cortez and Ilhan Omar are teaming up to ban the Pledge of Allegiance.,[]
581,0,politics,fact_check,False, Snopes.com,https://www.snopes.com/fact-check/desantis-biden-go-fuck-yourself/,"No, Gov. DeSantis Didn't Tell Biden 'Go F--- Yourself' 
The governor of Florida did express unhappiness over potential COVID-19 travel restrictions, but not in so many words.",2021-02-13,"Florida Gov. Ron DeSantis reacted to possible COVID-19 travel restrictions by telling U.S. President Joe Biden, ""Go fuck yourself"" during a February 2021 conference call.",[]
582,0,politics,fact_check,False, Snopes.com,https://www.snopes.com/fact-check/walgreens-closing-forever-2021/,"Is Walgreens 'Closing Forever in 2021'? 
An internet ad lured readers with a misleading headline.",2021-02-13,"Walgreens is ""closing forever in 2021.""",[]
583,0,politics,fact_check,Labeled Satire, Snopes.com,https://www.snopes.com/fact-check/biden-pardon-blm-protesters/,"Did Biden Pardon 2,617 BLM Protesters? 
A routine review of content labeled satire.",2021-02-13,"U.S. President Joe Biden pardoned 2,617 Black Lives Matter protesters.",[]
584,0,politics,fact_check,False, Snopes.com,https://www.snopes.com/fact-check/military-trump-60-days/,"Does Trump Control US Military for 60 Days After Leaving Office? 
The claim stemmed from 2019 legislation introduced by a Republican lawmaker.",2021-02-12,"Under former U.S. President Donald Trump, Congress passed a law that gives outgoing presidential administrations control of American armed forces after Inauguration Day, for up to 60 days.",[]
585,0,politics,fact_check,Correct Attribution, Snopes.com,https://www.snopes.com/fact-check/ted-cruz-trump-violence-quote/,"Did Ted Cruz Say Trump 'Has a Consistent Pattern of Inciting Violence'? 
A video from the 2016 presidential campaign was recirculated during former U.S. President Donald Trump's second impeachment trial.",2021-02-12,"U.S. Sen. Ted Cruz said in 2016 that ""Trump has a consistent pattern of inciting violence.""",[]
586,0,politics,fact_check,Mostly True, Snopes.com,https://www.snopes.com/fact-check/lyft-free-ride-job-interview/,"Does Lyft Provide Free Rides to Job Interviews? 
In early 2021, social media users enthusiastically shared a post about the ride-hailing company with the encouraging sign-off, ""If you need help, here's help.""",2021-02-12,The ride-hailing company Lyft provides users free rides to job interviews.,[]
587,0,politics,fact_check,Correct Attribution,Snopes.com,https://www.snopes.com/fact-check/dave-ramsey-stimulus-checks/,"Did Dave Ramsey Say Those Needing Stimulus Checks 'Were Pretty Much Screwed Already'?
The radio host made a comment on Fox News that was received unfavorably by many.",2021-02-12,"Financial adviser and radio host Dave Ramsey said he ""doesn't believe"" in stimulus checks to Americans because if you needed the money, ""you were pretty much screwed already.""",[]
588,0,politics,fact_check,Labeled Satire, Snopes.com,https://www.snopes.com/fact-check/mypillow-antifa-temptresses/,"Did MyPillow CEO Mike Lindell Blame Capitol Attack on 'Antifa Temptresses'? 
A routine review of content labeled satire.",2021-02-11,"MyPillow CEO Mike Lindell blamed ""antifa temptresses"" for the Jan. 6, 2021 attack on the U.S. Capitol.",[]
589,0,politics,fact_check,False, Snopes.com,https://www.snopes.com/fact-check/ted-cruz-sound-fury-quote/,"Did Ted Cruz Botch a Shakespeare Quote? 
As the world's first and only fact-checking organization named after Faulkner characters, we were shocked to hear demands that a soliloquy from ""Macbeth"" be attributed to the American author.",2021-02-11,"U.S. Sen. Ted Cruz messed up when he attributed the famous phrase ""full of sound and fury / signifying nothing"" to William Shakespeare.",[]
590,0,politics,fact_check,False,Snopes.com,https://www.snopes.com/fact-check/biden-uncf-funding-copypasta/,"Did Biden Revoke $250M That Trump Pledged to HBCUs?
A copypasta meme circulating on social media got several facts wrong.",2021-02-11,U.S. President Joe Biden revoked $250 million in funding for Historically Black Colleges and Universities pledged by former President Donald Trump.,[]
591,0,politics,fact_check,True, Snopes.com,https://www.snopes.com/fact-check/condom-consent-ban-california/,"Would a California Bill Ban Removing a Condom Without Consent? 
State Assembly Member Cristina Garcia has proposed legislation to combat ""stealthing,"" and leave perpetrators open to damages.",2021-02-11,"In early 2021, California Assembly Member Cristina Garcia published legislation to include ""stealthing"" under the definition of sexual battery in the state's civil code.",[]
592,0,politics,fact_check,True,Snopes.com,https://www.snopes.com/fact-check/trump-peacefully-and-patriotically/,"Did Dem Video Omit Trump's Saying 'Peacefully and Patriotically' Protest?
Social media posts claimed impeachment prosecutors ignored a key fact.",2021-02-11,"In a video displayed during U.S. President Donald Trump's second impeachment trial on Feb. 9, 2021, House Democrats did not show footage of Trump telling supporters on Jan. 6 to ""peacefully and patriotically make your voices heard.""",[]
593,0,politics,fact_check,Misattributed, Snopes.com,https://www.snopes.com/fact-check/churchill-confederate-monument/,"Did Churchill Say 'People With Contempt for Their Heritage Have Lost Faith in Themselves'? 
A Confederate monument in Georgia attributed a stirring quotation to the famous British statesman. But who actually said it?",2021-02-10,"Winston Churchill once said or wrote, ""Any people with contempt for their heritage have lost faith in themselves and no nation can long survive without pride in its traditions.""",[]
594,0,politics,fact_check,Correct Attribution,Snopes.com,https://www.snopes.com/fact-check/mike-shirkey-capitol-riot-hoax/,"Did Michigan Sen. Mike Shirkey Suggest Capitol Riot Was a ‘Hoax’?
The local Michigan GOP censured Shirkey for pushing false conspiracy theories.",2021-02-10,"During a lunch with leaders of the Hillsdale County Republican Party held on Feb. 3, 2021, Michigan state Senate Majority Leader Mike Shirkey suggested that the Jan. 6 riot at the U.S. Capitol was a “hoax.”",[]
595,0,politics,fact_check,False, Snopes.com,https://www.snopes.com/fact-check/costco-closing-stores/,"Is Costco Closing Stores 'Across the Nation'? 
A misleading online advertisement purported to break big business news about Costco Wholesale.",2021-02-10,Costco closed stores across the U.S. in February 2021.,[]
596,0,politics,fact_check,Miscaptioned, Snopes.com,https://www.snopes.com/fact-check/joe-biden-movie-set-oval-office/,"Is This Biden on a Movie Set Resembling the Oval Office? 
Denying reality won't stop it from happening.",2021-02-10,A photograph shows U.S. President Joe Biden on a movie set designed to look like the Oval Office.,[]
597,0,politics,fact_check,False, Snopes.com,https://www.snopes.com/fact-check/trump-impeachment-air-force-one/,"Did Trump Say He Would Testify at Impeachment Trial if He Could Take Air Force One? 
Some obvious jokes aren't so obvious.",2021-02-09,"Former U.S. President Donald Trump said that he would testify during his second impeachment trial if could to travel to Washington, D.C., on Air Force One.",[]
598,0,politics,fact_check,Mostly True,Snopes.com,https://www.snopes.com/fact-check/potus-greeting-card-100-birthday/,"Does the POTUS Send People a Greeting Card on Their 100th Birthday?
People want White House greetings on all kinds of occasions.",2021-02-09,The U.S. president will send a “letter of congratulations” or birthday greeting card to Americans who turn 100 years old.,[]
599,0,politics,fact_check,Correct Attribution, Snopes.com,https://www.snopes.com/fact-check/proud-boys-name-aladdin-song/,"Did the Proud Boys' Name Come from an 'Aladdin' Song? 
The extremist hate group’s name has a curious origin, according to their founder Gavin McInnes.",2021-02-09,"Proud Boys founder Gavin McInnes said inspiration for the group’s name came from “Proud of Your Boy,” a song from the stage musical ""Aladdin.""",[]
600,0,politics,fact_check,False, Snopes.com,https://www.snopes.com/fact-check/adam-sandler-trump/,"Was Adam Sandler Revealed to be a Supporter of Donald Trump? 
A lengthy list of conservative celebrities who purportedly backed Donald Trump was advertised with a picture of actor and comedian Adam Sandler.",2021-02-09,The website Definition.org revealed that Adam Sandler was a Trump supporter.,[]
601,0,politics,fact_check,False, Snopes.com,https://www.snopes.com/fact-check/kamala-harris-sworn-in-purse/,"Was Vice President Kamala Harris Sworn in On a Purse? 
A zipped leather case became fodder for conspiracy theorists.",2021-01-27,U.S. Vice President Kamala Harris took the oath of office with her hand on a purse.,[]
602,0,politics,fact_check,False, Snopes.com,https://www.snopes.com/fact-check/alexandria-ocasio-cortez-husband/,"Is Alexandra Ocasio-Cortez Married with a Husband? 
A misleading online advertisement with a picture of the U.S. representative purportedly teased a reveal of her husband's name.",2021-02-08,U.S. Rep. Alexandria Ocasio-Cortez was married with a husband in early February 2021.,[]
603,0,politics,fact_check,Mostly True, Snopes.com,https://www.snopes.com/fact-check/trump-hotel-price-hike-march-4/,"Did Trump's DC Hotel Hike Prices on Date of His Fictional '2nd Inauguration'? 
Some adherents to the QAnon conspiracy theories believe Trump will begin a second term on March 4, 2021.",2021-02-08,"Room rates at Donald Trump's Washington, D.C., hotel spiked dramatically for March 4, 2021 — the date on which some conspiracy theorists believe he will be inaugurated again.",[]
604,0,politics,fact_check,True, Snopes.com,https://www.snopes.com/fact-check/juli-briskman-elected-flip-trump/,"Did Juli Briskman Lose Her Job After Flipping Off Trump, Then Get Elected in County Home to His Golf Club? 
One of Trump's golf clubs is reportedly located in the county where Juli Briskman now holds an elected seat.",2021-02-08,"In January 2021, Juli Briskman, a Democrat from Virginia who once flipped off President Donald Trump's motorcade, was elected to office in a jurisdiction where one of his golf clubs is located.",[]
605,0,politics,fact_check,Mixture, Snopes.com,https://www.snopes.com/fact-check/biden-keystone-pipeline-find-a-job/,"Did Biden Admin Tell Keystone Pipeline Workers 'Find Another Job'? 
A partisan media source mischaracterized the White House press secretary's comments.",2021-02-05,"A screenshot taken from TV coverage of a White House news conference displays a chyron accurately stating that the Biden administration had told pipeline workers, ""You can find another job.""",[]
606,0,politics,fact_check,Unproven, Snopes.com,https://www.snopes.com/fact-check/joe-jill-biden-booed-super-bowl/,"Were the Bidens Booed During Their Speech at the Super Bowl? 
In a pre-recorded video televised before the game, U.S. President Joe Biden and first lady Jill Biden thanked frontline healthcare workers.",2021-02-08,"U.S. President Joe Biden and first lady Jill Biden were booed during their pre-recorded statement that aired just before the Super Bowl game on Feb. 7, 2021.",[]
607,0,politics,fact_check,False,Snopes.com,https://www.snopes.com/fact-check/harris-military-against-trumpers/,"No, Kamala Harris Didn't Threaten To Use the Military Against 'Trumpers'
The VP supposedly said she does not care about the Constitution and will use federal law enforcement and the military against Trump supporters.",2021-02-08,U.S. Vice President Kamala Harris threatened to use 'federal law enforcement and the military ... against Trumpers',[]
608,0,politics,fact_check,False, Snopes.com,https://www.snopes.com/fact-check/biden-abortion-exec-order/,"Did Biden Sign an Executive Order Allowing the U.S. to Fund Abortions Abroad? 
The so-called ""global gag rule"" was instated by Ronald Reagan in 1984.",2021-02-07,President Joe Biden signed an executive order in 2021 allowing the U.S. to fund abortions abroad.,[]
609,0,politics,fact_check,Mixture, Snopes.com,https://www.snopes.com/fact-check/keystone-pipeline-biden/,"Did Biden's Order To Halt Keystone XL Pipeline 'Destroy' 11,000 Jobs? 
The exact number of jobs eliminated as a result of an executive order to halt the pipeline's construction remained unknown.",2021-02-08,"U.S. President Joe Biden's Jan. 20, 2021, executive order to halt construction of the Keystone XL pipeline ""destroyed"" 11,000 jobs.",[]
610,0,politics,fact_check,True,Snopes.com,https://www.snopes.com/fact-check/capitol-rioter-permission-vacation/,"Did Capitol Rioter Jenny Cudd Ask Judge for Permission To Vacation in Mexico?
Accused rioters need vacation time too, apparently.",2021-02-03,"Jenny Cudd, a woman accused of participating in the mob attack on the U.S. Capitol, asked a judge to let her travel to Mexico for a four-day vacation planned for February 2021.",[]
611,0,politics,fact_check,True, Snopes.com,https://www.snopes.com/fact-check/joe-biden-stutter/,"Does Joe Biden Have a Speech Impediment? 
""God’s gift to me was my stuttering,” Biden once said.",2021-02-07,U.S. President Joe Biden has a speech impediment.,[]
612,0,politics,fact_check,False, Snopes.com,https://www.snopes.com/fact-check/biden-fake-air-force-one/,"Does Biden's ""Fake Air Force One"" Prove He Is Not Really President? 
Any plane carrying the President is designated ""Air Force One.""",2021-02-07,"On Joe Biden's first trip home to Delaware as President, the plane he flew was not Air Force One, proving Donald Trump remains President.",[]
613,0,politics,fact_check,Labeled Satire, Snopes.com,https://www.snopes.com/fact-check/biden-defund-veterans/,"Did Biden Announce Plans to Defund Veteran Affairs? 
A routine review of content labeled satire.",2021-02-06,U.S. President Joe Biden announced plans to defund the Department of Veteran Affairs.,[]
614,0,politics,fact_check,False, Snopes.com,https://www.snopes.com/fact-check/trump-quit-costco-letter/,"Did Trump Quit Costco Membership in This Letter? 
A letter purportedly sent by former U.S. President Donald Trump to Costco spoke of ""an eight-pound tub of coconut clusters"" and rotisserie chickens.",2021-02-06,"An image showed former U.S. President Donald Trump canceled his Costco membership in a letter dated Feb. 4, 2021.",[]
615,0,politics,fact_check,False, Snopes.com,https://www.snopes.com/fact-check/fbi-agents-hunter-biden/,"No, An FBI Agent Killed in Florida Wasn't Investigating Hunter Biden's Laptop 
Social media memes claimed without evidence that an FBI agent killed while serving a search warrant was investigating Hunter Biden.",2021-02-05,One of two FBI agents killed while serving a search warrant in an investigation into violent crimes against children was the top agent in an investigation into child pornography found on Hunter Biden's laptop.,[]
616,0,politics,fact_check,Mostly True, Snopes.com,https://www.snopes.com/fact-check/marjorie-greene-armed-high-school/,"Did an Armed Student Take Hostages at Marjorie Taylor Greene's High School? 
The controversial Republican Congresswoman defended her stance on gun rights by describing her own experience as an 11th grader in Forsyth County, Georgia.",2021-02-05,"While U.S. Rep. Marjorie Taylor Greene was in high school, one of her fellow students held hostages at gunpoint, giving her firsthand experience of ""the fear"" associated with gun violence.",[]
617,0,politics,fact_check,True, Snopes.com,https://www.snopes.com/fact-check/florida-town-trump-week/,"Did a Florida Town Declare the First Week of February 'Trump Week'? 
The city of Frostproof in Florida's Polk County has a population of about 3,200.",2021-02-05,"The government of Frostproof, Florida, approved a proposal to declare Feb. 1 through Feb. 6 as ""Donald J. Trump week.""",[]
618,0,politics,fact_check,True, Snopes.com,https://www.snopes.com/fact-check/congress-french-freedom-fries-iraq/,"Did Congress Rename Their French Fries to ‘Freedom Fries’ Before the Iraq War? 
France expressed opposition to United States-led military action in Iraq.",2021-02-05,"In 2003, the U.S Congress renamed french fries sold in their cafeterias to “freedom fries” after France expressed opposition to the U.S.-led invasion of Iraq.",[]
619,0,politics,fact_check,True, Snopes.com,https://www.snopes.com/fact-check/onion-marjorie-taylor-greene/,"Did an Onion Headline Mirror a Rep. Greene Tweet? 
The satirical work of The Onion can reflect reality.",2021-02-05,"The Onion published a satirical article warning that removing U.S. Rep. Marjorie Taylor Greene from committee assignments would leave her with more free time, shortly before Greene commented that being removed from committee assignments had given her more free time.",[]
620,0,politics,fact_check,True, Snopes.com,https://www.snopes.com/fact-check/iranians-arrested-mexico-border/,"Were 11 Iranians Arrested at US-Mexico Border? 
Citizens from special interest countries illegally crossing into the U.S. by way of Mexico is not that uncommon, according to Customs and Border Protection.",2021-02-05,"On Feb. 1, 2021, nearly a dozen Iranian citizens were arrested after attempting to illegally cross into the United States from Mexico.",[]
621,0,politics,fact_check,True, Snopes.com,https://www.snopes.com/fact-check/sag-letter-president-trump/,"Was Trump's SAG-AFTRA Letter Signed 'President Donald J. Trump'? 
Using the title of “President” in a signature does not appear to be out of the ordinary among former presidents.",2021-02-05,"In a Feb. 4, 2021, letter resigning from the Screen Actors Guild (SAG-AFTRA), a union for film and television performers, former U.S. President Donald Trump signed his name as “President Donald J. Trump.”",[]
622,0,politics,fact_check,False,Snopes.com,https://www.snopes.com/fact-check/andrew-yang-old-york/,"Does Andrew Yang Want To Rename NYC Because There's No 'Old York'?
Andrew Yang is running for mayor of New York, not Old York.",2021-02-05,Andrew Yang said that New York City should just be called York because there isn't an Old York.,[]
623,0,politics,fact_check,none, Snopes.com,https://www.snopes.com/fact-check/candace-owens-pelosi-capitol/,"RUMOR ALERT: Did Candace Owens Accuse Pelosi of Knowing in Advance About the Capitol Riots? 
More evidence is required before this claim can be rated in a traditional Snopes fact check.",2021-02-04,"In a Jan. 14 post, conservative pundit Candace Owen accused Nancy Pelosi and Democrats of having prior knowledge of the Capitol riots, and disregarding security warnings in order to “engineer” events to ruin former President Donald Trump’s life.",[]
624,0,politics,fact_check,Mixture, Snopes.com,https://www.snopes.com/fact-check/biden-guantamano-bay-vaccine/,"Did Biden Give Gitmo Prisoners COVID-19 Vaccines Before Americans? 
Doses were first sent to the Guantanamo Bay naval base before being dispersed to facilities across the military compound.",2021-02-04,U.S. President Joe Biden rolled out a plan to administer COVID-19 immunizations to detainees held at the Guantanamo Bay prison camp in Cuba before many Americans had received their first dose.,[]
625,0,politics,fact_check,Correct Attribution, Snopes.com,https://www.snopes.com/fact-check/pelosi-mccarthy-press-release/,"Did Pelosi Issue a Statement Calling Kevin McCarthy 'Q-CA'? 
A news release issued by House Speaker Nancy Pelosi's office contained a dig at Kevin McCarthy.",2021-02-04,"U.S. House Speaker Nancy Pelosi's office published a news release referring to House Minority Leader Kevin McCarthy's political affiliation as ""Q-CA"" in reference to the QAnon conspiracy movement.",[]
